"","Sitio","Grupo","Tipo","Fecha","Transecto","Bloque","Numero","SHJ_ID","FVE_ID","DFM_ID","Final_ID","Codigo","Largo","Swab","Dedo","Recap","Foto","Muerto","Notas","...20","sample_date","year"
"1","LL-N","Estacion","N","1/9/22",3,"A","1","priach","priach","priach","priach","2",3.5,"Y","Y","N","1",NA,NA,NA,2022-09-01,"2022"
"2","LL-N","Estacion","N","1/9/22",3,"A","2","priach","priach","priach","priach","2",3.6,"Y","Y","N","2",NA,NA,NA,2022-09-01,"2022"
"3","LL-N","Estacion","N","1/9/22",4,"A","3","priach","priach","priach","priach","2",3.4,"Y","Y","N","3",NA,NA,NA,2022-09-01,"2022"
"4","LL-N","Estacion","N","1/9/22",4,"C","4","priach","priach","priach","priach","2",2.3,"Y","Y","N","4",NA,NA,NA,2022-09-01,"2022"
"5","LL-N","Estacion","N","1/9/22",4,"D","5","priach","priach","priach","priach","22",3.9,"Y","Y","N","5",NA,"lost dedo, so cut 0022, escapó uno del 4D",NA,2022-09-01,"2022"
"6","LL-C","Estacion","C","1/9/22",1,"A","6","priach","priach","priach","priach","3",4.2,"Y","Y","N","6",NA,NA,NA,2022-09-01,"2022"
"7","LL-C","Estacion","C","1/9/22",1,"C","7","priach","priach","priach","priach","3",4,"Y","Y","N","7",NA,NA,NA,2022-09-01,"2022"
"8","LL-C","Estacion","C","1/9/22",1,"D","8","priach","priach","priach","priach","3",3.5,"Y","Y","N","8",NA,NA,NA,2022-09-01,"2022"
"9","LL-C","Estacion","C","1/9/22",2,"A","9","priach","priach","priach","priach","3",0.9,"Y","Y","N","9",NA,NA,NA,2022-09-01,"2022"
"10","LL-C","Estacion","C","1/9/22",2,"D","10","priach","priach","priach","priach","3",2.8,"Y","Y","N","10",NA,NA,NA,2022-09-01,"2022"
"11","LL-C","Estacion","C","1/9/22",2,"D","11","priach","priach","priach","priach","3",3.2,"Y","Y","N","11",NA,NA,NA,2022-09-01,"2022"
"12","LL-C","Estacion","C","1/9/22",3,"B","12","priach","priach","priach","priach","3",2.8,"Y","Y","N","12",NA,NA,NA,2022-09-01,"2022"
"13","LL-C","Estacion","C","1/9/22",3,"B","13","priach","priach","priach","priach","3",3.3,"Y","Y","N","13",NA,NA,NA,2022-09-01,"2022"
"14","LL-C","Estacion","C","1/9/22",3,"C","14","priach","priach","priach","priach","3",2.2,"Y","Y","N","14",NA,NA,NA,2022-09-01,"2022"
"15","LL-C","Estacion","C","1/9/22",3,"D","15","priach","priach","priach","priach","3",2.3,"Y","Y","N","15",NA,NA,NA,2022-09-01,"2022"
"16","LL-C","Estacion","C","1/9/22",4,"A","16","priach","priach","priach","priach","3",3.9,"Y","Y","N","16",NA,NA,NA,2022-09-01,"2022"
"17","LL-C","Estacion","C","1/9/22",4,"C","17","priach","priach","priach","priach","3",3.2,"Y","Y","N","17",NA,NA,NA,2022-09-01,"2022"
"18","JZ-C","Estacion","C","2/9/22",1,"B","18","priach","priach","priach","priach","505",2.9,"Y","Y","N","18",NA,"lost dedo, so recut to get genetic sample",NA,2022-09-02,"2022"
"19","JZ-C","Estacion","C","2/9/22",1,"D","19","priach","priach","priach","priach","5",3,"Y","Y","N","19",NA,NA,NA,2022-09-02,"2022"
"20","JZ-C","Estacion","C","2/9/22",1,"D","20","priach","priach","priach","priach","5",2.4,"Y","Y","N","20",NA,NA,NA,2022-09-02,"2022"
"21","JZ-C","Estacion","C","2/9/22",2,"B","21","priach","priach","priach","priach","5",3.9,"Y","Y","N","21",NA,NA,NA,2022-09-02,"2022"
"22","JZ-C","Estacion","C","2/9/22",2,"D","22","priach","priach","priach","priach","5",2.6,"Y","Y","N","22",NA,NA,NA,2022-09-02,"2022"
"23","JZ-N","Estacion","N","2/9/22",1,"D","23","priach","priach","priach","priach","20",3.2,"Y","Y","N","23",NA,NA,NA,2022-09-02,"2022"
"24","LL-C","Estacion","C","3/9/22",1,"A","24","priach","priach","priach","priach","33",1.1,"Y","Y","N","24",NA,"lost dedo, so cut two",NA,2022-09-03,"2022"
"25","LL-C","Estacion","C","3/9/22",1,"A","25","priach","priach","priach","priach","3",2.9,"Y","Y","N","25",NA,NA,NA,2022-09-03,"2022"
"26","LL-C","Estacion","C","3/9/22",2,"D","26","priach","priach","priach","priach","3",2.8,"Y","Y","N","26",NA,"escapó uno de 3B",NA,2022-09-03,"2022"
"27","LL-C","Estacion","C","3/9/22",3,"A","27","priach","priach","priach","priach","3",2.8,"Y","Y","N","27",NA,NA,NA,2022-09-03,"2022"
"28","LL-C","Estacion","C","3/9/22",3,"C","28","priach","priach","priach","priach","3",2.2,"Y","Y","N","28",NA,NA,NA,2022-09-03,"2022"
"29","LL-C","Estacion","C","3/9/22",4,"C","29","priach","priach","priach","priach","3",2.1,"Y","Y","N","29",NA,NA,NA,2022-09-03,"2022"
"30","LL-C","Estacion","C","3/9/22",4,"C","30","priach","priach","priach","priach","3",2.7,"Y","Y","N","30",NA,NA,NA,2022-09-03,"2022"
"31","LL-N","Estacion","N","3/9/22",1,"B","31","priach","priach","priach","priach","2",2.6,"Y","Y","N","31",NA,NA,NA,2022-09-03,"2022"
"32","LL-N","Estacion","N","3/9/22",1,"B","32","priach","priach","priach","priach","2",2.6,"Y","Y","N","32",NA,"escapó uno de 1C",NA,2022-09-03,"2022"
"33","LL-N","Estacion","N","3/9/22",1,"D","33","priach","priach","priach","priach","2",2.9,"Y","Y","N","33",NA,NA,NA,2022-09-03,"2022"
"34","LL-N","Estacion","N","3/9/22",1,"D","34","priach","priach","priach","priach","2",2.9,"Y","Y","N","34",NA,NA,NA,2022-09-03,"2022"
"35","LL-N","Estacion","N","3/9/22",2,"A","35","priach","priach","priach","priach","2",3.5,"Y","Y","N","35",NA,NA,NA,2022-09-03,"2022"
"36","LL-N","Estacion","N","3/9/22",2,"C","36","priach","priach","priach","priach","2",2.9,"Y","Y","N","36",NA,NA,NA,2022-09-03,"2022"
"37","LL-N","Estacion","N","3/9/22",2,"C","37","priach","priach","priach","priach","2",3.1,"Y","Y","N","37",NA,NA,NA,2022-09-03,"2022"
"38","LL-N","Estacion","N","3/9/22",2,"C","38","priach","priach","priach","priach","2",1.8,"Y","Y","N","38",NA,NA,NA,2022-09-03,"2022"
"39","LL-N","Estacion","N","3/9/22",2,"D","39","priach","priach","priach","priach","2",2.8,"Y","Y","N","39",NA,NA,NA,2022-09-03,"2022"
"40","LL-N","Estacion","N","3/9/22",4,"B","40","priach","priach","priach","priach","2",3.7,"Y","Y","N","40",NA,NA,NA,2022-09-03,"2022"
"41","LL-N","Estacion","N","3/9/22",4,"B","41","priach","priach","priach","priach","2",2.8,"Y","Y","N","41",NA,NA,NA,2022-09-03,"2022"
"42","LL-N","Estacion","N","3/9/22",4,"B","42","priach","priach","priach","priach","2",3,"Y","Y","N","42",NA,NA,NA,2022-09-03,"2022"
"43","LL-N","Estacion","N","3/9/22",4,"C","43","priach","priach","priach","priach","2",3.4,"Y","Y","N","43",NA,NA,NA,2022-09-03,"2022"
"44","JZ-N","Estacion","N","5/9/22",1,"C","44","priach","priach","priach","priach","20",3.4,"Y","Y","N","44",NA,NA,NA,2022-09-05,"2022"
"45","JZ-N","Estacion","N","5/9/22",2,"A","45","priach","priach","priach","priach","20",2.3,"Y","Y","N","45",NA,NA,NA,2022-09-05,"2022"
"46","JZ-N","Estacion","N","5/9/22",3,"D","46","priach","priach","priach","priach","20",1.8,"Y","Y","N","46",NA,NA,NA,2022-09-05,"2022"
"47","JZ-N","Estacion","N","5/9/22",4,"A","47","priach","priach","priach","priach","20",4.3,"Y","Y","N","47",NA,NA,NA,2022-09-05,"2022"
"48","JZ-C","Estacion","C","5/9/22",1,"A","48","priach","priach","priach","priach","5",2.1,"Y","Y","N","48",NA,"uno escapo del 1B",NA,2022-09-05,"2022"
"49","JZ-C","Estacion","C","5/9/22",1,"C","49","priach","priach","priach","priach","5",4.2,"Y","Y","N","49",NA,NA,NA,2022-09-05,"2022"
"50","JZ-C","Estacion","C","5/9/22",2,"B","50","priach","priach","priach","priach","5",2.6,"Y","Y","N","50",NA,NA,NA,2022-09-05,"2022"
"51","JZ-C","Estacion","C","5/9/22",2,"C","51","priach","priach","priach","priach","5",2.8,"Y","Y","N","51",NA,NA,NA,2022-09-05,"2022"
"52","JZ-C","Estacion","C","5/9/22",3,"C","52","priach","priach","priach","priach","5",1.9,"Y","Y","N","52",NA,NA,NA,2022-09-05,"2022"
"53","JZ-C","Estacion","C","5/9/22",3,"D","53","priach","priach","priach","priach","5",3.2,"Y","Y","N","53",NA,NA,NA,2022-09-05,"2022"
"54","LL-N","Estacion","N","6/9/22",1,"A","54","priach","priach","priach","priach","2",2.9,"Y","Y","N","54",NA,"uno escapo del 1C",NA,2022-09-06,"2022"
"55","LL-N","Estacion","N","6/9/22",2,"A","55","priach","priach","priach","priach","2",2.7,"Y","Y","N","55",NA,NA,NA,2022-09-06,"2022"
"56","LL-N","Estacion","N","6/9/22",2,"B","56","priach","priach","priach","priach","2",2.9,"Y","Y","N","56",NA,NA,NA,2022-09-06,"2022"
"57","LL-N","Estacion","N","6/9/22",2,"C","57","priach","priach","priach","priach","2",1.9,"Y","Y","N","57",NA,NA,NA,2022-09-06,"2022"
"58","LL-N","Estacion","N","6/9/22",2,"B","58","priach","priach","priach","priach","2",3.6,"Y","Y","N","58",NA,NA,NA,2022-09-06,"2022"
"59","LL-N","Estacion","N","6/9/22",2,"D","59","priach","priach","priach","priach","2",3.1,"Y","Y","N","59",NA,NA,NA,2022-09-06,"2022"
"60","LL-N","Estacion","N","6/9/22",3,"B","60","priach","priach","priach","priach","2",4.1,"Y","Y","N","60",NA,NA,NA,2022-09-06,"2022"
"61","LL-N","Estacion","N","6/9/22",3,"C","61","priach","priach","priach","priach","2",NA,"Y","N","N","61",NA,"escapo, no pudimos medir ni cortar dedo pero si hay swab",NA,2022-09-06,"2022"
"62","LL-N","Estacion","N","6/9/22",3,"B","62","priach","priach","priach","priach","2",2.9,"Y","Y","N","62",NA,NA,NA,2022-09-06,"2022"
"63","LL-N","Estacion","N","6/9/22",4,"B","63","priach","priach","priach","priach","2",3.9,"Y","Y","N","63",NA,NA,NA,2022-09-06,"2022"
"64","LL-N","Estacion","N","6/9/22",4,"B","64","priach","priach","priach","priach","2",2.7,"Y","Y","N","64",NA,NA,NA,2022-09-06,"2022"
"65","LL-N","Estacion","N","6/9/22",4,"B","65","priach","priach","priach","priach","2",3.8,"Y","Y","N","65",NA,NA,NA,2022-09-06,"2022"
"66","LL-N","Estacion","N","6/9/22",4,"C","66","epibou","epibou","epibou","epibou","2",1.6,"Y","Y","N","66",NA,NA,NA,2022-09-06,"2022"
"67","LL-N","Estacion","N","6/9/22",4,"D","67","priach","priach","priach","priach","2",2.5,"Y","Y","N","67",NA,NA,NA,2022-09-06,"2022"
"68","LL-N","Estacion","N","6/9/22",4,"D","68","priach","priach","priach","priach","2",2.8,"Y","Y","N","68",NA,NA,NA,2022-09-06,"2022"
"69","LL-C","Estacion","C","6/9/22",1,"A","69","priach","priach","priach","priach","3",1.3,"Y","Y","N","69","muerto","murió",NA,2022-09-06,"2022"
"70","LL-C","Estacion","C","6/9/22",1,"C","70","priach","priach","priach","priach","3",3.1,"Y","Y","N","70",NA,NA,NA,2022-09-06,"2022"
"71","LL-C","Estacion","C","6/9/22",2,"A","71","priach","priach","priach","priach","3",0.8,"Y","Y","N","71",NA,NA,NA,2022-09-06,"2022"
"72","LL-C","Estacion","C","6/9/22",2,"C","72","priach","priach","priach","priach","3",2.8,"Y","Y","N","72",NA,NA,NA,2022-09-06,"2022"
"73","LL-C","Estacion","C","6/9/22",3,"A","73","priach","priach","priach","priach","3",2.6,"Y","Y","N","73",NA,NA,NA,2022-09-06,"2022"
"74","LL-C","Estacion","C","6/9/22",3,"B","74","priach","priach","priach","priach","3",2.9,"Y","Y","N","74",NA,NA,NA,2022-09-06,"2022"
"75","LL-C","Estacion","C","6/9/22",3,"C","75","priach","priach","priach","priach","3",3,"Y","Y","N","75",NA,NA,NA,2022-09-06,"2022"
"76","LL-C","Estacion","C","6/9/22",3,"C","76","priach","priach","priach","priach","3",2.6,"Y","Y","N","76",NA,NA,NA,2022-09-06,"2022"
"77","JZ-C","Estacion","C","7/9/22",1,"A","77","priach","priach","priach","priach","5",2.4,"Y","Y","N","77",NA,NA,NA,2022-09-07,"2022"
"78","JZ-C","Estacion","C","7/9/22",1,"A","78","priach","priach","priach","priach","5",2.9,"Y","Y","N","77",NA,NA,NA,2022-09-07,"2022"
"79","JZ-C","Estacion","C","7/9/22",1,"D","79","priach","priach","priach","priach","5",3.6,"Y","Y","N","79",NA,NA,NA,2022-09-07,"2022"
"80","JZ-C","Estacion","C","7/9/22",1,"D","80","priach","priach","priach","priach","5",3.6,"Y","Y","N","80",NA,NA,NA,2022-09-07,"2022"
"81","JZ-C","Estacion","C","7/9/22",2,"A","81","priach","priach","priach","priach","5",2.9,"Y","Y","N","79",NA,NA,NA,2022-09-07,"2022"
"82","JZ-C","Estacion","C","7/9/22",2,"A","82","priach","priach","priach","priach","5",1.7,"Y","Y","N","82",NA,NA,NA,2022-09-07,"2022"
"83","JZ-C","Estacion","C","7/9/22",2,"C","83","priach","priach","priach","priach","5",3,"Y","Y","N","R15",NA,NA,NA,2022-09-07,"2022"
"84","JZ-C","Estacion","C","7/9/22",3,"D","84","priach","priach","priach","priach","5",2.9,"Y","Y","N","77",NA,NA,NA,2022-09-07,"2022"
"85","JZ-C","Estacion","C","7/9/22",3,"D","85","smipha","smipha","smipha","smipha","5",6.9,"Y","Y","N","85",NA,NA,NA,2022-09-07,"2022"
"86","JZ-C","Estacion","C","7/9/22",4,"B","86","boaboa","boaboa","boaboa","boaboa","5",6.5,"Y","Y","N","86",NA,NA,NA,2022-09-07,"2022"
"87","JZ-C","Estacion","C","7/9/22",4,"D","87","priach","priach","priach","priach","5",3.2,"Y","Y","N","79",NA,NA,NA,2022-09-07,"2022"
"88","JZ-N","Estacion","N","7/9/22",1,"D","89","rhiala","rhiala","rhiala","rhiala","0022 + 0005",1.6,"Y","Y","N","89",NA,"mal corté, tuve que arreglarlo",NA,2022-09-07,"2022"
"89","JZ-N","Estacion","N","7/9/22",2,"A","90","priach","priach","priach","priach","20",2.7,"Y","Y","N","R17",NA,NA,NA,2022-09-07,"2022"
"90","JZ-N","Estacion","N","7/9/22",2,"B","91","priach","priach","priach","priach","20",2.9,"Y","Y","N","R17",NA,NA,NA,2022-09-07,"2022"
"91","JZ-N","Estacion","N","7/9/22",2,"C","92","rhiala","rhiala","rhiala","rhiala","20",2,"Y","Y","N","92",NA,NA,NA,2022-09-07,"2022"
"92","FCAT-V2","Estacion","V","8/9/22",1,"C","93","oopsyl","oopsyl","oopsyl","oopsyl","30",2.5,"Y","Y","N","93",NA,NA,NA,2022-09-08,"2022"
"93","FCAT-V2","Estacion","V","8/9/22",2,"A","94","priach","priach","priach","priach","30",2.8,"Y","Y","N","94",NA,NA,NA,2022-09-08,"2022"
"94","FCAT-V2","Estacion","V","8/9/22",3,"D","95","priach","priach","priach","priach","30",2,"Y","Y","N","94",NA,NA,NA,2022-09-08,"2022"
"95","FCAT-V2","Estacion","V","8/9/22",4,"A","96","priach","priach","priach","priach","30",2,"Y","Y","N","96",NA,NA,NA,2022-09-08,"2022"
"96","FCAT-B2","Estacion","B","8/9/22",1,"B","97","oopsyl","oopsyl","oopsyl","oopsyl","0030 + 0040",1.8,"Y","Y","N","93",NA,"mal corté, tuve que arreglarlo",NA,2022-09-08,"2022"
"97","FCAT-B2","Estacion","B","8/9/22",1,"C","98","priach","priach","priach","priach","40",2.9,"Y","Y","N","94",NA,NA,NA,2022-09-08,"2022"
"98","FCAT-B2","Estacion","B","8/9/22",1,"C","99","priach","priach","priach","priach","40",2.9,"Y","Y","N","94",NA,NA,NA,2022-09-08,"2022"
"99","FCAT-B2","Estacion","B","8/9/22",2,"A","100","priwal","priwal","priach","priach","40",2.9,"Y","Y","N","100",NA,NA,NA,2022-09-08,"2022"
"100","FCAT-B2","Estacion","B","8/9/22",2,"D","101","epiesp","epiesp","epiesp","epiesp","0030 + 0040",1.8,"Y","Y","N","101",NA,"Epipedobates espinosai",NA,2022-09-08,"2022"
"101","FCAT-B2","Estacion","B","8/9/22",3,"A","102","oopsyl","oopsyl","oopsyl","oopsyl","40",2.2,"Y","Y","N","93",NA,NA,NA,2022-09-08,"2022"
"102","FCAT-B2","Estacion","B","8/9/22",3,"A","103","priach","priach","priach","priach","40",2.6,"Y","Y","N","94",NA,NA,NA,2022-09-08,"2022"
"103","FCAT-B2","Estacion","B","8/9/22",3,"A","104","priach","priach","priach","priach","40",2.6,"Y","Y","N","94",NA,NA,NA,2022-09-08,"2022"
"104","FCAT-B2","Estacion","B","8/9/22",4,"D","105","leubil","leubil","leubil","leubil","40",2.5,"Y","Y","N","105","colectado","muerto - tomamos el individuo para llevar al USFQ",NA,2022-09-08,"2022"
"105","AL-N","Estacion","N","9/9/22",1,"A","106","priach","priach","priach","priach","200",2,"Y","Y","N","106",NA,NA,NA,2022-09-09,"2022"
"106","AL-N","Estacion","N","9/9/22",2,"A","107","priach","priach","priach","priach","200",2.3,"Y","Y","N","106",NA,NA,NA,2022-09-09,"2022"
"107","AL-N","Estacion","N","9/9/22",2,"B","108","priach","priach","priach","priach","200",2.1,"Y","Y","N","108",NA,NA,NA,2022-09-09,"2022"
"108","AL-N","Estacion","N","9/9/22",2,"B","109","priach","priach","priach","priach","200",3.5,"Y","Y","N","109",NA,NA,NA,2022-09-09,"2022"
"109","AL-N","Estacion","N","9/9/22",2,"C","110","priach","priach","priach","priach","200",2.3,"Y","Y","N","106",NA,NA,NA,2022-09-09,"2022"
"110","AL-N","Estacion","N","9/9/22",3,"B","111","priach","priach","priach","priach","200",2.1,"Y","Y","N","111",NA,NA,NA,2022-09-09,"2022"
"111","AL-N","Estacion","N","9/9/22",4,"D","112","priach","priach","priach","priach","200",1.8,"Y","Y","N","106",NA,NA,NA,2022-09-09,"2022"
"112","JZJ-C","Estacion","C","9/9/22",1,"A","113","priach","priach","priach","priach","300",1.8,"Y","Y","N","106",NA,NA,NA,2022-09-09,"2022"
"113","JZJ-C","Estacion","C","9/9/22",1,"B","114","priach","priach","priach","priach","300",2.2,"Y","Y","N","114",NA,NA,NA,2022-09-09,"2022"
"114","JZJ-C","Estacion","C","9/9/22",1,"B","115","priach","priach","priach","priach","300",2.6,"Y","Y","N","114",NA,NA,NA,2022-09-09,"2022"
"115","JZJ-C","Estacion","C","9/9/22",1,"C","116","priach","priach","priach","priach","300",2.1,"Y","Y","N","116",NA,NA,NA,2022-09-09,"2022"
"116","JZJ-C","Estacion","C","9/9/22",1,"C","117","priach","priach","priach","priach","300",2.2,"Y","Y","N","117",NA,NA,NA,2022-09-09,"2022"
"117","JZJ-C","Estacion","C","9/9/22",1,"C","118","priach","priach","priach","priach","300",2.3,"Y","Y","N","114",NA,NA,NA,2022-09-09,"2022"
"118","JZJ-C","Estacion","C","9/9/22",1,"D","119","priach","priach","priach","priach","300",1.6,"Y","Y","N","114",NA,NA,NA,2022-09-09,"2022"
"119","JZJ-C","Estacion","C","9/9/22",2,"A","120","priach","priach","priach","priach","300",2.5,"Y","Y","N","117",NA,NA,NA,2022-09-09,"2022"
"120","JZJ-C","Estacion","C","9/9/22",2,"A","121","priach","priach","priach","priach","300",2.8,"Y","Y","N","106",NA,NA,NA,2022-09-09,"2022"
"121","JZJ-C","Estacion","C","9/9/22",2,"B","122","priach","priach","priach","priach","300",3.4,"Y","Y","N","122",NA,NA,NA,2022-09-09,"2022"
"122","JZJ-C","Estacion","C","9/9/22",2,"C","123","priach","priach","priach","priach","300",2.2,"Y","Y","N","123",NA,NA,NA,2022-09-09,"2022"
"123","JZJ-C","Estacion","C","9/9/22",2,"D","124","priach","priach","priach","priach","300",2.9,"Y","Y","N","123",NA,NA,NA,2022-09-09,"2022"
"124","JZJ-C","Estacion","C","9/9/22",3,"A","125","priach","priach","priach","priach","300",2.7,"Y","Y","N","108",NA,NA,NA,2022-09-09,"2022"
"125","JZJ-C","Estacion","C","9/9/22",3,"B","126","priach","priach","priach","priach","300",4.3,"Y","Y","N","108",NA,NA,NA,2022-09-09,"2022"
"126","JZJ-C","Estacion","C","9/9/22",3,"C","127","priach","priach","priach","priach","300",2.5,"Y","Y","N","114",NA,NA,NA,2022-09-09,"2022"
"127","JZJ-C","Estacion","C","9/9/22",3,"C","128","priach","priach","priach","priach","300",3.7,"Y","Y","N","108",NA,NA,NA,2022-09-09,"2022"
"128","JZJ-C","Estacion","C","9/9/22",3,"C","129","priach","priach","priach","priach","300",2.9,"Y","Y","N","109",NA,NA,NA,2022-09-09,"2022"
"129","JZJ-C","Estacion","C","9/9/22",3,"D","130","priach","priach","priach","priach","300",3.2,"Y","Y","N","109",NA,NA,NA,2022-09-09,"2022"
"130","JZJ-C","Estacion","C","9/9/22",3,"D","131","priach","priach","priach","priach","300",3,"Y","Y","N","109",NA,NA,NA,2022-09-09,"2022"
"131","JZJ-C","Estacion","C","9/9/22",4,"A","132","priach","priach","priach","priach","300",3.4,"Y","Y","N","132",NA,NA,NA,2022-09-09,"2022"
"132","JZJ-C","Estacion","C","9/9/22",4,"A","133","priach","priach","priach","priach","300",2.6,"Y","Y","N","132",NA,NA,NA,2022-09-09,"2022"
"133","JZJ-C","Estacion","C","9/9/22",4,"B","134","priach","priach","priach","priach","300",2.4,"Y","Y","N","108",NA,NA,NA,2022-09-09,"2022"
"134","JZJ-C","Estacion","C","9/9/22",4,"D","135","priach","priach","priach","priach","300",2.8,"Y","Y","N","109",NA,NA,NA,2022-09-09,"2022"
"135","JZJ-C","Estacion","C","9/9/22",4,"D","136","priach","priach","priach","priach","300",2.7,"Y","Y","N","108",NA,NA,NA,2022-09-09,"2022"
"136","FCAT-B2","Estacion","B","10/9/22",1,"A","137","epibou","epibou","epibou","epibou","40",1.6,"Y","Y","N","137",NA,NA,NA,2022-09-10,"2022"
"137","FCAT-B2","Estacion","B","10/9/22",2,"C","138","epibou","epibou","priach","priach","40",1.8,"Y","Y","N","138",NA,"confirmado que es priach - DFM, misma foto identificado como priach, epibou",NA,2022-09-10,"2022"
"138","FCAT-B2","Estacion","B","10/9/22",2,"D","139","priach","priach","priach","priach","40",3.6,"Y","Y","N","139",NA,NA,NA,2022-09-10,"2022"
"139","FCAT-B2","Estacion","B","10/9/22",3,"B","140","priach","priach","priach","priach","40",3,"Y","Y","N","139",NA,NA,NA,2022-09-10,"2022"
"140","FCAT-B2","Estacion","B","10/9/22",4,"A","141","priach","priach","priach","priach","40",3.2,"Y","Y","N","139",NA,NA,NA,2022-09-10,"2022"
"141","FCAT-B2","Estacion","B","10/9/22",4,"C","142","priach","priach","priach","priach","40",2.1,"Y","Y","N","138",NA,"misma foto identificado como priach, epibou, confirmado que es priach",NA,2022-09-10,"2022"
"142","FCAT-B2","Estacion","B","10/9/22",4,"D","143","priach","priach","priach","priach","40",2.6,"Y","Y","N","139",NA,NA,NA,2022-09-10,"2022"
"143","FCAT-B2","Estacion","B","10/9/22",4,"D","144","priach","priach","priach","priach","40",2.9,"Y","Y","N","139",NA,NA,NA,2022-09-10,"2022"
"144","FCAT-V2","Estacion","V","10/9/22",1,"A","145","priach","priach","priach","priach","30",3.8,"Y","Y","N","145",NA,NA,NA,2022-09-10,"2022"
"145","FCAT-V2","Estacion","V","10/9/22",1,"A","146","priach","priach","priach","priach","30",3.5,"Y","Y","N","139",NA,NA,NA,2022-09-10,"2022"
"146","FCAT-V2","Estacion","V","10/9/22",1,"B","147","priach","priach","priach","priach","30",2.3,"Y","Y","N","139",NA,NA,NA,2022-09-10,"2022"
"147","FCAT-V2","Estacion","V","10/9/22",1,"D","148","oopsyl","oopsyl","oopsyl","priach","30",2.9,"Y","Y","N","R19",NA,NA,NA,2022-09-10,"2022"
"148","FCAT-V2","Estacion","V","10/9/22",2,"A","149","priach","priach","priach","priach","30",3,"Y","Y","N","139",NA,NA,NA,2022-09-10,"2022"
"149","FCAT-V2","Estacion","V","10/9/22",2,"C","150","priach","priach","priach","priach","30",2.2,"Y","Y","N","139",NA,NA,NA,2022-09-10,"2022"
"150","FCAT-V2","Estacion","V","10/9/22",2,"C","151","priach","priach","priach","priach","30",3.4,"Y","Y","N","139",NA,NA,NA,2022-09-10,"2022"
"151","FCAT-V2","Estacion","V","10/9/22",2,"D","152","priach","priach","priach","priach","30",2.8,"Y","Y","N","152",NA,NA,NA,2022-09-10,"2022"
"152","FCAT-V2","Estacion","V","10/9/22",3,"D","153","priach","priach","priach","priach","30",2.8,"Y","Y","N","139",NA,NA,NA,2022-09-10,"2022"
"153","FCAT-V2","Estacion","V","10/9/22",3,"D","154","priach","priach","priach","priach","30",2.2,"Y","Y","N","154",NA,NA,NA,2022-09-10,"2022"
"154","JZJ-C","Estacion","C","12/9/22",1,"A","155","priach","priach","priach","priach","300",2.6,"Y","Y","N","155",NA,NA,NA,2022-09-12,"2022"
"155","JZJ-C","Estacion","C","12/9/22",1,"A","156","priach","priach","priach","priach","300",3.5,"Y","Y","N","156",NA,NA,NA,2022-09-12,"2022"
"156","JZJ-C","Estacion","C","12/9/22",1,"A","157","priach","priach","priach","priach","300",2,"Y","Y","N","157",NA,NA,NA,2022-09-12,"2022"
"157","JZJ-C","Estacion","C","12/9/22",1,"B","158","priach","priach","priach","priach","300",2.4,"Y","Y","N","157",NA,NA,NA,2022-09-12,"2022"
"158","JZJ-C","Estacion","C","12/9/22",1,"B","159","priach","priach","priach","priach","300",2.5,"Y","Y","N","156",NA,NA,NA,2022-09-12,"2022"
"159","JZJ-C","Estacion","C","12/9/22",1,"B","160","priach","priach","priach","priach","300",2.8,"Y","Y","N","155",NA,NA,NA,2022-09-12,"2022"
"160","JZJ-C","Estacion","C","12/9/22",1,"C","161","priach","priach","priach","priach","300",2.2,"Y","Y","N","160",NA,NA,NA,2022-09-12,"2022"
"161","JZJ-C","Estacion","C","12/9/22",2,"A","162","priach","priach","priach","priach","300",1.7,"Y","Y","N","157",NA,NA,NA,2022-09-12,"2022"
"162","JZJ-C","Estacion","C","12/9/22",2,"B","163","priach","priach","priach","priach","300",3.6,"Y","Y","N","155",NA,NA,NA,2022-09-12,"2022"
"163","JZJ-C","Estacion","C","12/9/22",2,"B","164","priach","priach","priach","priach","300",3.3,"Y","Y","N","155",NA,NA,NA,2022-09-12,"2022"
"164","JZJ-C","Estacion","C","12/9/22",2,"C","165","priach","priach","priach","priach","300",2.3,"Y","Y","N","156",NA,NA,NA,2022-09-12,"2022"
"165","JZJ-C","Estacion","C","12/9/22",2,"C","166","priach","priach","priach","priach","300",3.9,"Y","Y","N","166",NA,NA,NA,2022-09-12,"2022"
"166","JZJ-C","Estacion","C","12/9/22",3,"A","167","priach","priach","priach","priach","300",3.4,"Y","Y","N","166",NA,NA,NA,2022-09-12,"2022"
"167","JZJ-C","Estacion","C","12/9/22",3,"B","168","priach","priach","priach","priach","300",2.6,"Y","Y","N","168",NA,NA,NA,2022-09-12,"2022"
"168","JZJ-C","Estacion","C","12/9/22",3,"B","169","priach","priach","priach","priach","300",1.9,"Y","Y","N","169",NA,NA,NA,2022-09-12,"2022"
"169","JZJ-C","Estacion","C","12/9/22",3,"C","170","priach","priach","priach","priach","300",3.3,"Y","Y","N","170",NA,"en amplexus",NA,2022-09-12,"2022"
"170","JZJ-C","Estacion","C","12/9/22",3,"C","171","priach","priach","priach","priach","300",2.7,"Y","Y","N","156",NA,"en amplexus",NA,2022-09-12,"2022"
"171","JZJ-C","Estacion","C","12/9/22",3,"D","172","priach","priach","priach","priach","300",2.3,"Y","Y","N","169",NA,NA,NA,2022-09-12,"2022"
"172","JZJ-C","Estacion","C","12/9/22",3,"D","173","priach","priach","priach","priach","300",2.5,"Y","Y","N","157",NA,NA,NA,2022-09-12,"2022"
"173","JZJ-C","Estacion","C","12/9/22",4,"A","174","priach","priach","priach","priach","300",2.1,"Y","Y","N","157",NA,NA,NA,2022-09-12,"2022"
"174","JZJ-C","Estacion","C","12/9/22",4,"B","175","priach","priach","priach","priach","300",3.4,"Y","Y","N","170",NA,NA,NA,2022-09-12,"2022"
"175","JZJ-C","Estacion","C","12/9/22",4,"C","176","priach","priach","priach","priach","300",2.2,"Y","Y","N","169",NA,NA,NA,2022-09-12,"2022"
"176","AL-N","Estacion","N","12/9/22",1,"A","177","priach","priach","priach","priach","200",2.4,"Y","Y","N","169",NA,NA,NA,2022-09-12,"2022"
"177","AL-N","Estacion","N","12/9/22",2,"C","178","priach","priach","priach","priach","2000 + 0300 + 0200",4,"Y","Y","N","166",NA,"mal corté pero arreglado",NA,2022-09-12,"2022"
"178","AL-N","Estacion","N","12/9/22",2,"C","179","priach","priach","priach","priach","200",2.5,"Y","Y","N","169",NA,NA,NA,2022-09-12,"2022"
"179","AL-N","Estacion","N","12/9/22",3,"D","180","priach","priach","priach","priach","2000 + 0300 + 0200",2.9,"Y","Y","N","166",NA,"mal corté pero arreglado",NA,2022-09-12,"2022"
"180","AL-N","Estacion","N","12/9/22",4,"D","181","priach","priach","priach","priach","200",3.5,"Y","Y","N","169",NA,NA,NA,2022-09-12,"2022"
"181","AL-N","Estacion","N","12/9/22",4,"D","182","priach","priach","priach","priach","200",3,"Y","Y","N","182",NA,NA,NA,2022-09-12,"2022"
"182","FCAT-V2","Estacion","V","13/09/22",2,"C","183","priach","priach","priach","priach","30",2.5,"Y","Y","N","183",NA,NA,NA,2022-09-13,"2022"
"183","FCAT-V2","Estacion","V","13/09/22",3,"B","184","priach","priach","priach","priach","30",4.2,"Y","Y","N","184",NA,NA,NA,2022-09-13,"2022"
"184","FCAT-V2","Estacion","V","13/09/22",3,"C","185","priach","priach","priach","priach","30",2.7,"Y","Y","N","183",NA,NA,NA,2022-09-13,"2022"
"185","FCAT-V2","Estacion","V","13/09/22",4,"D","186","pri?","prilat","prilat","Sequence","30",2,"Y","Y","N","186","colectado","muerto, llevado a USFQ para muestra - es latadiscus?",NA,2022-09-13,"2022"
"186","FCAT-V2","Estacion","V","13/09/22",4,"D","187","priach","priach","priach","priach","30",3.9,"Y","Y","N","184",NA,NA,NA,2022-09-13,"2022"
"187","FCAT-B2","Estacion","B","13/09/22",1,"C","188","oopsyl","oopsyl","oopsyl","oopsyl","4000 + 0040 + 0030",3.1,"Y","Y","N","188",NA,"mal corté pero arreglado",NA,2022-09-13,"2022"
"188","FCAT-B2","Estacion","B","13/09/22",1,"D","189","priach","priach","priach","priach","40",4,"Y","Y","N","184",NA,NA,NA,2022-09-13,"2022"
"189","FCAT-B2","Estacion","B","13/09/22",2,"D","190","priach","priach","priach","priach","40",2.1,"Y","Y","N","R32",NA,NA,NA,2022-09-13,"2022"
"190","FCAT-B2","Estacion","B","13/09/22",2,"D","191","priach","priach","priach","priach","40",4,"Y","Y","N","191",NA,NA,NA,2022-09-13,"2022"
"191","FCAT-B2","Estacion","B","13/09/22",3,"A","192","priach","priach","priach","priach","40",3.4,"Y","Y","N","191",NA,NA,NA,2022-09-13,"2022"
"192","FCAT-B2","Estacion","B","13/09/22",3,"B","193","lepper","leprho","leppen","Sequence","40",11.7,"Y","Y","N","193",NA,NA,NA,2022-09-13,"2022"
"193","FCAT-B2","Estacion","B","13/09/22",3,"D","194","priach","priach","priach","priach","40",3.6,"Y","Y","N","184",NA,NA,NA,2022-09-13,"2022"
"194","FCAT-B2","Estacion","B","13/09/22",4,"C","195","priach","priach","priach","priach","40",2.5,"Y","Y","N","184",NA,NA,NA,2022-09-13,"2022"
"195","FCAT-B2","Estacion","B","13/09/22",4,"D","196","priach","priach","priach","priach","40",2.7,"Y","Y","N","183",NA,NA,NA,2022-09-13,"2022"
"196","AL-N","Estacion","N","14/09/22",1,"C","197","priach","priach","priach","priach","200",2.9,"Y","Y","N","197",NA,NA,NA,2022-09-14,"2022"
"197","AL-N","Estacion","N","14/09/22",1,"C","198","priach","priach","priach","priach","200",2,"Y","Y","N","198",NA,NA,NA,2022-09-14,"2022"
"198","AL-N","Estacion","N","14/09/22",1,"D","199","priwal","priwal","priwal","priwal","200",2.9,"Y","Y","N","199",NA,NA,NA,2022-09-14,"2022"
"199","AL-N","Estacion","N","14/09/22",2,"D","200","priach","priach","priach","priach","200",2.9,"Y","Y","N","200",NA,NA,NA,2022-09-14,"2022"
"200","AL-N","Estacion","N","14/09/22",3,"A","201","priach","priach","priach","priach","200",2.7,"Y","Y","N","200",NA,NA,NA,2022-09-14,"2022"
"201","AL-N","Estacion","N","14/09/22",3,"A","202","priach","priach","priach","priach","200",2.9,"Y","Y","N","200",NA,NA,NA,2022-09-14,"2022"
"202","AL-N","Estacion","N","14/09/22",3,"B","203","priach","priach","priach","priach","200",2.2,"Y","Y","N","198",NA,NA,NA,2022-09-14,"2022"
"203","AL-N","Estacion","N","14/09/22",4,"C","204","prilab","priesm","prilat","Sequence","200",1.4,"Y","Y","N","204","colectado","traido a la USFQ, FVE no esta seguro que es P. esmeraldas",NA,2022-09-14,"2022"
"204","JZJ-C","Estacion","C","14/09/22",1,"C","205","priach","priach","priach","priach","300",2.4,"Y","Y","N","200",NA,NA,NA,2022-09-14,"2022"
"205","JZJ-C","Estacion","C","14/09/22",1,"D","206","priach","priach","priach","priach","300",2.6,"Y","Y","N","197",NA,NA,NA,2022-09-14,"2022"
"206","JZJ-C","Estacion","C","14/09/22",1,"D","207","priach","priach","priach","priach","300",2.5,"Y","Y","N","200",NA,NA,NA,2022-09-14,"2022"
"207","JZJ-C","Estacion","C","14/09/22",1,"D","208","priach","priach","priach","priach","300",3.9,"Y","Y","N","200",NA,NA,NA,2022-09-14,"2022"
"208","JZJ-C","Estacion","C","14/09/22",1,"D","209","priach","priach","priach","priach","300",3.8,"Y","Y","N","200",NA,NA,NA,2022-09-14,"2022"
"209","JZJ-C","Estacion","C","14/09/22",1,"D","210","priach","priach","priach","priach","300",2.9,"Y","Y","N","200",NA,NA,NA,2022-09-14,"2022"
"210","JZJ-C","Estacion","C","14/09/22",2,"B","211","priach","priach","priach","priach","300",2.2,"Y","Y","N","197",NA,NA,NA,2022-09-14,"2022"
"211","JZJ-C","Estacion","C","14/09/22",2,"B","212","priach","priach","priach","priach","300",3.7,"Y","Y","N","212",NA,NA,NA,2022-09-14,"2022"
"212","JZJ-C","Estacion","C","14/09/22",2,"C","213","priach","priach","priach","priach","300",3.3,"Y","Y","N","200",NA,NA,NA,2022-09-14,"2022"
"213","JZJ-C","Estacion","C","14/09/22",2,"C","214","priach","priach","priach","priach","300",2.5,"Y","Y","N","200",NA,NA,NA,2022-09-14,"2022"
"214","JZJ-C","Estacion","C","14/09/22",2,"D","215","priach","priach","priach","priach","300",2.3,"Y","Y","N","200",NA,NA,NA,2022-09-14,"2022"
"215","JZJ-C","Estacion","C","14/09/22",2,"D","216","priach","priach","priach","priach","300",2.5,"Y","Y","N","216",NA,NA,NA,2022-09-14,"2022"
"216","JZJ-C","Estacion","C","14/09/22",3,"B","217","priach","priach","priach","priach","300",2.6,"Y","Y","N","217",NA,NA,NA,2022-09-14,"2022"
"217","JZJ-C","Estacion","C","14/09/22",3,"B","218","priach","priach","priach","priach","300",1.8,"Y","Y","N","198",NA,NA,NA,2022-09-14,"2022"
"218","JZJ-C","Estacion","C","14/09/22",4,"A","219","priach","priach","priach","priach","300",4,"Y","Y","N","217",NA,NA,NA,2022-09-14,"2022"
"219","JZJ-C","Estacion","C","14/09/22",4,"A","220","priach","priach","priach","priach","300",2,"Y","Y","N","197",NA,NA,NA,2022-09-14,"2022"
"220","JZJ-C","Estacion","C","14/09/22",4,"C","221","priach","priach","priach","priach","300",3.9,"Y","Y","N","217",NA,NA,NA,2022-09-14,"2022"
"221","JZJ-C","Estacion","C","14/09/22",4,"C","222","priach","priach","priach","priach","300",1.6,"Y","Y","N","222",NA,NA,NA,2022-09-14,"2022"
"222","JZJ-C","Estacion","C","14/09/22",4,"C","223","priach","priach","priach","priach","300",3.6,"Y","Y","N","212",NA,NA,NA,2022-09-14,"2022"
"223","JZJ-C","Estacion","C","14/09/22",4,"D","224","priach","priach","priach","priach","300",3.3,"Y","Y","N","217",NA,NA,NA,2022-09-14,"2022"
"224","JZJ-C","Estacion","C","14/09/22",4,"D","225","priach","priach","priach","priach","300",2.9,"Y","Y","N","217",NA,NA,NA,2022-09-14,"2022"
"225","FCAT-B1","Estacion","B","15/09/22",1,"A","226","pri?","cralon","cralon","Sequence","500",3.4,"Y","Y","N","226","colectado","llevado a la USFQ",NA,2022-09-15,"2022"
"226","FCAT-B1","Estacion","B","15/09/22",2,"A","227","priach","priach","priach","priach","500",1.6,"Y","Y","N","227",NA,NA,NA,2022-09-15,"2022"
"227","FCAT-B1","Estacion","B","15/09/22",2,"B","228","priach","priach","priach","priach","500",4.2,"Y","Y","N","228",NA,NA,NA,2022-09-15,"2022"
"228","FCAT-B1","Estacion","B","15/09/22",2,"B","229","priach","priach","priach","priach","500",3,"Y","Y","N","229",NA,NA,NA,2022-09-15,"2022"
"229","FCAT-B1","Estacion","B","15/09/22",2,"C","230","prilat","prilat","priach","priach","500",2.2,"Y","Y","N","230",NA,"Pristimantis laticlavius, llevado a la estacion pero liberado",NA,2022-09-15,"2022"
"230","FCAT-B1","Estacion","B","15/09/22",3,"A","231","epibou","epibou","epibou","epibou","500",1.9,"Y","Y","N","231",NA,NA,NA,2022-09-15,"2022"
"231","FCAT-B1","Estacion","B","15/09/22",3,"A","232","priach","priach","priach","priach","500",1.9,"Y","Y","N","227",NA,NA,NA,2022-09-15,"2022"
"232","FCAT-B1","Estacion","B","15/09/22",3,"C","233","oopsyl","oopsyl","oopsyl","oopsyl","500",2.1,"Y","Y","N","233",NA,NA,NA,2022-09-15,"2022"
"233","FCAT-B1","Estacion","B","15/09/22",3,"C","234","priach","priach","priach","priach","500",3.2,"Y","Y","N","234",NA,NA,NA,2022-09-15,"2022"
"234","FCAT-B1","Estacion","B","15/09/22",3,"C","235","epibou","epibou","epibou","epibou","500",1.8,"Y","Y","N","231",NA,NA,NA,2022-09-15,"2022"
"235","FCAT-B1","Estacion","B","15/09/22",4,"A","236","priach","priach","priach","priach","500",2,"Y","Y","N","236",NA,NA,NA,2022-09-15,"2022"
"236","FCAT-B1","Estacion","B","15/09/22",4,"A","237","oopsyl","oopsyl","oopsyl","oopsyl","500",2.8,"Y","Y","N","233",NA,NA,NA,2022-09-15,"2022"
"237","FCAT-V1","Estacion","V","15/09/22",1,"A","238","priach","priach","priach","priach","2000",2.9,"Y","Y","N","234",NA,NA,NA,2022-09-15,"2022"
"238","FCAT-V1","Estacion","V","15/09/22",1,"C","239","priach","priach","priach","priach","2200",3.7,"Y","Y","N","234",NA,"recapturado de pruebas, corté 0200 para tener un dedo",NA,2022-09-15,"2022"
"239","FCAT-V1","Estacion","V","15/09/22",1,"C","240","priach","priach","priach","priach","2000",2.7,"Y","Y","N","228",NA,NA,NA,2022-09-15,"2022"
"240","FCAT-V1","Estacion","V","15/09/22",2,"B","241","priach","priach","priach","priach","2000",3,"Y","Y","N","241",NA,NA,NA,2022-09-15,"2022"
"241","FCAT-V1","Estacion","V","15/09/22",2,"B","242","pri?","cralon","cralon","Sequence","2000",1.7,"Y","Y","N","226","colectado","llevado a la USFQ para muestra, mismo como 226",NA,2022-09-15,"2022"
"242","FCAT-V1","Estacion","V","15/09/22",2,"C","243","oopsyl","oopsyl","oopsyl","oopsyl","2000",2.1,"Y","Y","N","233",NA,NA,NA,2022-09-15,"2022"
"243","FCAT-V1","Estacion","V","15/09/22",2,"C","244","oopsyl","oopsyl","oopsyl","oopsyl","2000",2.3,"Y","Y","N","233",NA,NA,NA,2022-09-15,"2022"
"244","FCAT-V1","Estacion","V","15/09/22",2,"D","245","priach","priach","priach","priach","2000",2.6,"Y","Y","N","229",NA,NA,NA,2022-09-15,"2022"
"245","FCAT-V1","Estacion","V","15/09/22",3,"B","246","priach","priach","priach","priach","2000",2.2,"Y","Y","N","227",NA,NA,NA,2022-09-15,"2022"
"246","FCAT-V1","Estacion","V","15/09/22",3,"B","247","priach","priach","priach","priach","2000",3.2,"Y","Y","N","228",NA,NA,NA,2022-09-15,"2022"
"247","FCAT-V1","Estacion","V","15/09/22",3,"C","248","priach","priach","priach","priach","2000",3.2,"Y","Y","N","234",NA,NA,NA,2022-09-15,"2022"
"248","FCAT-V1","Estacion","V","15/09/22",4,"A","249","priach","priach","priach","priach","2000",3.9,"Y","Y","N","228",NA,NA,NA,2022-09-15,"2022"
"249","FCAT-V1","Estacion","V","15/09/22",4,"A","250","priach","priach","priach","priach","2000",2.6,"Y","Y","N","229",NA,NA,NA,2022-09-15,"2022"
"250","FCAT-V1","Estacion","V","15/09/22",4,"B","251","priach","priach","priach","priach","2000",2.2,"Y","Y","N","227",NA,NA,NA,2022-09-15,"2022"
"251","FCAT-V1","Estacion","V","15/09/22",4,"D","252","priach","priach","priach","priach","2000",3,"Y","Y","N","234",NA,NA,NA,2022-09-15,"2022"
"252","FCAT-V1","Estacion","V","17/09/22",1,"A","253","priach","priach","priach","priach","2000",1.9,"Y","Y","N","R44",NA,NA,NA,2022-09-17,"2022"
"253","FCAT-V1","Estacion","V","17/09/22",1,"A","254","priach","priach","priach","priach","2000",2.3,"Y","Y","N","R44",NA,NA,NA,2022-09-17,"2022"
"254","FCAT-V1","Estacion","V","17/09/22",1,"B","255","priach","priach","priach","priach","2000",2.5,"Y","Y","N","R44",NA,NA,NA,2022-09-17,"2022"
"255","FCAT-V1","Estacion","V","17/09/22",1,"C","256","oopsyl","oopsyl","oopsyl",NA,"2000",2.7,"Y","Y","N","256",NA,"misma foto identificado como oopsyl y priach",NA,2022-09-17,"2022"
"256","FCAT-V1","Estacion","V","17/09/22",1,"C","257","priach","priach","priach","priach","2000",2.9,"Y","Y","N","257",NA,NA,NA,2022-09-17,"2022"
"257","FCAT-V1","Estacion","V","17/09/22",1,"C","258","priach","priach","priach","priach","2000",3.7,"Y","Y","N","258",NA,NA,NA,2022-09-17,"2022"
"258","FCAT-V1","Estacion","V","17/09/22",2,"B","259","priach","priach","priach","priach","2000",3.6,"Y","Y","N","259",NA,NA,NA,2022-09-17,"2022"
"259","FCAT-V1","Estacion","V","17/09/22",2,"C","260","priach","priach",NA,NA,"2000",2.7,"Y","Y","N","256",NA,"misma foto identificado como oopsyl y priach",NA,2022-09-17,"2022"
"260","FCAT-V1","Estacion","V","17/09/22",2,"D","261","pri?","prinie","Pristimantis cf. calcarulatus","Sequence","2000",2.7,"Y","Y","N","261","colectado","llevado a la USFQ, estaba en un arbol, no estaba el FVE que es P. nietoi",NA,2022-09-17,"2022"
"261","FCAT-V1","Estacion","V","17/09/22",3,"A","262","priach","priach","priach","priach","2000",2.4,"Y","Y","N","R44",NA,NA,NA,2022-09-17,"2022"
"262","FCAT-V1","Estacion","V","17/09/22",3,"A","263","priach","priach","priach","priach","2000",2.3,"Y","Y","N","263",NA,NA,NA,2022-09-17,"2022"
"263","FCAT-V1","Estacion","V","17/09/22",3,"A","264","pri?","priros","priach","Sequence","2000",3.5,"Y","Y","N","264","colectado","llevado a la USFQ, pristmantis w nigrum?",NA,2022-09-17,"2022"
"264","FCAT-V1","Estacion","V","17/09/22",3,"C","265","oopsyl","oopsyl",NA,NA,"2000",2,"Y","Y","N","256",NA,"misma foto identificado como oopsyl y priach",NA,2022-09-17,"2022"
"265","FCAT-V1","Estacion","V","17/09/22",4,"A","266","priach","priach","priach","priach","2000",2,"Y","Y","N","259",NA,NA,NA,2022-09-17,"2022"
"266","FCAT-V1","Estacion","V","17/09/22",4,"A","267","priach","priach","priach","priach","2000",3.2,"Y","Y","N","267",NA,NA,NA,2022-09-17,"2022"
"267","FCAT-V1","Estacion","V","17/09/22",4,"B","268","priach","priach","priach","priach","2000",2.7,"Y","Y","N","R44",NA,NA,NA,2022-09-17,"2022"
"268","FCAT-V1","Estacion","V","17/09/22",4,"C","269","oopsyl","oopsyl","priach",NA,"2000",2.2,"Y","Y","N","256",NA,"confirmado es priach - DFM, misma foto identificado como oopsyl y priach",NA,2022-09-17,"2022"
"269","FCAT-V1","Estacion","V","17/09/22",4,"D","270","priach","priach","priach","priach","2000",2.5,"Y","Y","N","258",NA,NA,NA,2022-09-17,"2022"
"270","FCAT-V1","Estacion","V","17/09/22",4,"D","271","priach","priach","priach","priach","2000",4.3,"Y","Y","N","269",NA,NA,NA,2022-09-17,"2022"
"271","FCAT-B1","Estacion","B","17/09/22",2,"D","272","priach","priach","priach","priach","500",4,"Y","Y","N","272",NA,NA,NA,2022-09-17,"2022"
"272","FCAT-B1","Estacion","B","17/09/22",3,"A","273","priach","priach","priach","priach","2505",2.3,"Y","Y","N","258",NA,"mal corté pero arreglado",NA,2022-09-17,"2022"
"273","FCAT-B1","Estacion","B","17/09/22",4,"A","274","bolsim","bolsim","bolsim","bolsim","500",8.9,"Y","Y","N","274",NA,"bolitoglossa sima",NA,2022-09-17,"2022"
"274","FCAT-B1","Estacion","B","17/09/22",4,"C","275","lepper","lepven","lepper","Sequence","500",12.5,"Y","Y","N","275",NA,"foto correcta",NA,2022-09-17,"2022"
"275","FCAT-B1","Estacion","B","17/09/22",4,"D","276","pri?","pri?","prilat","prilat","500",2.6,"Y","Y","N","276","colectado","llevado a la USFQ, estaba en un arbol",NA,2022-09-17,"2022"
"276","FCAT-B1","Estacion","B","19/09/22",1,"A","277","oopsyl","oopsyl","oopsyl","oopsyl","500",2.4,"Y","Y","N","277",NA,NA,NA,2022-09-19,"2022"
"277","FCAT-B1","Estacion","B","19/09/22",1,"A","278","priach","priach","priach","priach","500",2.3,"Y","Y","N","278",NA,NA,NA,2022-09-19,"2022"
"278","FCAT-B1","Estacion","B","19/09/22",2,"A","279","priach","priach","priach","priach","500",3.6,"Y","Y","N","279",NA,NA,NA,2022-09-19,"2022"
"279","FCAT-B1","Estacion","B","19/09/22",3,"A","280","prilat","prilat","prilat","prilat","500",1.4,"Y","Y","N","280",NA,"misma especies como la verde traida a la estacion",NA,2022-09-19,"2022"
"280","FCAT-V1","Estacion","V","19/09/22",1,"A","281","prilat","prilat","prilat","prilat","2000",1.1,"Y","Y","N","281",NA,"misma especies como la verde traida a la estacion",NA,2022-09-19,"2022"
"281","FCAT-V1","Estacion","V","19/09/22",2,"A","282","prilat","prilat","prilat","prilat","2000",1,"Y","Y","N","281",NA,"misma especies como la verde traida a la estacion",NA,2022-09-19,"2022"
"282","FCAT-V1","Estacion","V","19/09/22",2,"A","283","pri?","prilati?","priach","priach","2000",2.9,"Y","Y","N","283",NA,"misma como boca blanca",NA,2022-09-19,"2022"
"283","FCAT-V1","Estacion","V","19/09/22",2,"A","284","priach","priach","priach","priach","2000",2.2,"Y","Y","N","284",NA,NA,NA,2022-09-19,"2022"
"284","FCAT-V1","Estacion","V","19/09/22",2,"B","285","priach","priach","priach","priach","2000",2.9,"Y","Y","N","285",NA,NA,NA,2022-09-19,"2022"
"285","FCAT-V1","Estacion","V","19/09/22",2,"D","286","priach","priach","priach","priach","2000",3.1,"Y","Y","N","286",NA,NA,NA,2022-09-19,"2022"
"286","FCAT-V1","Estacion","V","19/09/22",3,"A","287","priach","priach","priach","priach","2000",1.7,"Y","Y","N","284",NA,NA,NA,2022-09-19,"2022"
"287","FCAT-V1","Estacion","V","19/09/22",3,"B","288","priach","priach","priach","priach","2000",1.7,"Y","Y","N","284",NA,NA,NA,2022-09-19,"2022"
"288","FCAT-V1","Estacion","V","19/09/22",4,"C","289","priach","priach","priach","priach","2000",2.6,"Y","Y","N","289",NA,"latidiscus?",NA,2022-09-19,"2022"
"289","FCAT-V1","Estacion","V","19/09/22",4,"C","290","oopsyl","oopsyl","oopsyl","oopsyl","2000",2.4,"Y","Y","N","272",NA,NA,NA,2022-09-19,"2022"
"290","FLL-B","Laguna","B","3/10/22",1,"A","291","priach","priach","priach","priach","5",2.9,"Y","Y","N","291",NA,NA,NA,2022-10-03,"2022"
"291","FLL-B","Laguna","B","3/10/22",2,"A","292","priach","priach","priach","priach","5",3.5,"Y","Y","N","292",NA,NA,NA,2022-10-03,"2022"
"292","FLL-B","Laguna","B","3/10/22",3,"A","293","priach","priach","priach","priach","5",2.9,"Y","Y","N","293",NA,NA,NA,2022-10-03,"2022"
"293","FLL-B","Laguna","B","3/10/22",4,"A","294","priach","priach","priach","priach","5",2.7,"Y","Y","N","294",NA,NA,NA,2022-10-03,"2022"
"294","FLL-V","Laguna","V","3/10/22",1,"B","295","barpul","barpul","barpul","barpul","20",2.1,"Y","Y","N","295",NA,"barycholos pulcher",NA,2022-10-03,"2022"
"295","FLL-V","Laguna","V","3/10/22",1,"C","296","priach","priach","priach","priach","20",2.4,"Y","Y","N","296",NA,NA,NA,2022-10-03,"2022"
"296","FLL-V","Laguna","V","3/10/22",1,"C","297","priach","priach","priach","priach","20",3.9,"Y","Y","N","293",NA,NA,NA,2022-10-03,"2022"
"297","FLL-V","Laguna","V","3/10/22",1,"C","298","epibou","epibou","epibou","epibou","20",1.6,"Y","Y","N","298",NA,NA,NA,2022-10-03,"2022"
"298","FLL-V","Laguna","V","3/10/22",1,"D","299","barpul","barpul","barpul","barpul","20",2.4,"Y","Y","N","299",NA,NA,NA,2022-10-03,"2022"
"299","FLL-V","Laguna","V","3/10/22",2,"A","300","priach","priach","priach","priach","0020 + 0005 + 0002",2.9,"Y","Y","N","292",NA,"mal corte",NA,2022-10-03,"2022"
"300","FLL-V","Laguna","V","3/10/22",2,"A","301","priach","priach","priach","priach","20",3.9,"Y","Y","N","293",NA,NA,NA,2022-10-03,"2022"
"301","FLL-V","Laguna","V","3/10/22",2,"A","302","priach","priach","priach","priach","20",3.7,"Y","Y","N","302",NA,NA,NA,2022-10-03,"2022"
"302","FLL-V","Laguna","V","3/10/22",2,"B","303","cralon","cralon","priach","priach","20",3.9,"Y","Y","N","303",NA,NA,NA,2022-10-03,"2022"
"303","FLL-V","Laguna","V","3/10/22",2,"B","304","priach","priach","priach","priach","20",3.9,"Y","Y","N","304",NA,NA,NA,2022-10-03,"2022"
"304","FLL-V","Laguna","V","3/10/22",3,"A","305","priach","priach","priach","priach","20",3.4,"Y","Y","N","293",NA,NA,NA,2022-10-03,"2022"
"305","FLL-V","Laguna","V","3/10/22",3,"A","306","priach","priach","priach","priach","20",4.1,"Y","Y","N","306",NA,NA,NA,2022-10-03,"2022"
"306","FLL-V","Laguna","V","3/10/22",3,"A","307","barpul","barpul","barpul","barpul","20",1.8,"Y","Y","N","295",NA,NA,NA,2022-10-03,"2022"
"307","FLL-V","Laguna","V","3/10/22",3,"B","308","barpul","barpul","barpul","barpul","20",2.5,"Y","Y","N","295",NA,NA,NA,2022-10-03,"2022"
"308","FLL-V","Laguna","V","3/10/22",3,"C","309","priach","priach","priach","priach","20",3.4,"Y","Y","N","292",NA,NA,NA,2022-10-03,"2022"
"309","FLL-V","Laguna","V","3/10/22",3,"D","310","priach","priach","priach","priach","20",4,"Y","Y","N","310",NA,NA,NA,2022-10-03,"2022"
"310","FLL-V","Laguna","V","3/10/22",4,"A","311","priach","priach","priach","priach","20",2.7,"Y","Y","N","292",NA,NA,NA,2022-10-03,"2022"
"311","FLL-V","Laguna","V","3/10/22",4,"A","312","lepmel","leplab","lepven","Sequence","20",6.4,"Y","Y","N","312","colectado","leptodactilus melanonostus, traido a la estacion como muestra. en campo lepmel, FVE leplab, lepven Dani",NA,2022-10-03,"2022"
"312","FLL-C","Laguna","C","3/10/22",1,"A","313","priach","priach","priach","priach","3",4,"Y","Y","N","292",NA,NA,NA,2022-10-03,"2022"
"313","FLL-C","Laguna","C","3/10/22",1,"B","314","priach","priach","priach","priach","3",2.9,"Y","Y","N","310",NA,NA,NA,2022-10-03,"2022"
"314","FLL-C","Laguna","C","3/10/22",1,"B","315","priach","priach","priach","priach","3",2.7,"Y","Y","N","315",NA,NA,NA,2022-10-03,"2022"
"315","FLL-C","Laguna","C","3/10/22",1,"C","316","priach","priach","priach","priach","3",4.1,"Y","Y","N","316",NA,NA,NA,2022-10-03,"2022"
"316","FLL-C","Laguna","C","3/10/22",2,"B","317","epibou","epibou","epibou","epibou","3",1.5,"Y","Y","N","298",NA,NA,NA,2022-10-03,"2022"
"317","FLL-C","Laguna","C","3/10/22",2,"B","318","epibou","epibou","epibou","epibou","3",1.7,"Y","Y","N","298",NA,NA,NA,2022-10-03,"2022"
"318","FLL-C","Laguna","C","3/10/22",2,"C","319","priach","priach","priach","priach","3",3.6,"Y","Y","N","316",NA,NA,NA,2022-10-03,"2022"
"319","FLL-C","Laguna","C","3/10/22",2,"C","320","priach","priach","priach","priach","3",2.7,"Y","Y","N","316",NA,NA,NA,2022-10-03,"2022"
"320","FLL-C","Laguna","C","3/10/22",2,"D","321","priach","priach","priach","priach","3",2.8,"Y","Y","N","293",NA,NA,NA,2022-10-03,"2022"
"321","FLL-C","Laguna","C","3/10/22",3,"A","322","priach","priach","priach","priach","3",2.7,"Y","Y","N","310",NA,NA,NA,2022-10-03,"2022"
"322","FLL-C","Laguna","C","3/10/22",3,"C","323","priach","priach","priach","priach","3",2.9,"Y","Y","N","323",NA,NA,NA,2022-10-03,"2022"
"323","FLL-C","Laguna","C","3/10/22",3,"C","324","priach","priach","priach","priach","3",2.7,"Y","Y","N","324",NA,NA,NA,2022-10-03,"2022"
"324","FLL-C","Laguna","C","3/10/22",3,"D","325","priach","priach","priach","priach","3",2.7,"Y","Y","N","316",NA,NA,NA,2022-10-03,"2022"
"325","FLL-C","Laguna","C","3/10/22",4,"A","326","priach","priach","priach","priach","3",2.6,"Y","Y","N","326",NA,NA,NA,2022-10-03,"2022"
"326","FLL-C","Laguna","C","3/10/22",4,"A","327","lepmel","lepmel","lepven",NA,"33",6,"Y","Y","N","312",NA,NA,NA,2022-10-03,"2022"
"327","FLL-C","Laguna","C","3/10/22",4,"A","328","priach","priach","priach","priach","3",4,"Y","Y","N","328",NA,NA,NA,2022-10-03,"2022"
"328","FLL-C","Laguna","C","3/10/22",4,"A","329","priach","priach","priach","priach","3",2.6,"Y","Y","N","329",NA,NA,NA,2022-10-03,"2022"
"329","FLL-C","Laguna","C","3/10/22",4,"B","330","priach","priach","priach","priach","3",2.5,"Y","Y","N","329",NA,NA,NA,2022-10-03,"2022"
"330","FLL-C","Laguna","C","3/10/22",4,"B","331","barpul","barpul","barpul","barpul","3",2.6,"Y","Y","N","331",NA,NA,NA,2022-10-03,"2022"
"331","FLL-C","Laguna","C","3/10/22",4,"C","332","priach","priach","priach","priach","3",3.9,"Y","Y","N","332",NA,NA,NA,2022-10-03,"2022"
"332","FLL-C","Laguna","C","3/10/22",4,"C","333","priach","priach","priach","priach","3",2.3,"Y","Y","N","323",NA,NA,NA,2022-10-03,"2022"
"333","FLL-C","Laguna","C","3/10/22",4,"C","334","priach","priach","priach","priach","3",2.4,"Y","Y","N","310",NA,NA,NA,2022-10-03,"2022"
"334","FLL-C","Laguna","C","3/10/22",4,"C","335","scitsa","scitsa","scitsa","scitsa","3",2.4,"Y","Y","N","335",NA,"Scinax tsachila?",NA,2022-10-03,"2022"
"335","FLL-C","Laguna","C","3/10/22",4,"D","336","scitsa","scitsa","boapel","boapel","3",2.6,"Y","Y","N","boapel",NA,"Scinax tsachila? - Es un juvenil de boapel - DFM",NA,2022-10-03,"2022"
"336","JS-N","Laguna","N","3/10/22",1,"B","337","barpul","barpul","barpul","barpul","2",2.2,"Y","Y","N","295",NA,NA,NA,2022-10-03,"2022"
"337","JS-N","Laguna","N","3/10/22",1,"A","338","barpul","barpul","barpul","barpul","2",2.7,"Y","Y","N","295",NA,NA,NA,2022-10-03,"2022"
"338","JS-N","Laguna","N","3/10/22",2,"A","339","priach","priach","priach","priach","2",2.7,"Y","Y","N","339",NA,NA,NA,2022-10-03,"2022"
"339","JS-N","Laguna","N","3/10/22",2,"A","340","priach","priach","priach","priach","2",2,"Y","Y","N","294",NA,NA,NA,2022-10-03,"2022"
"340","JS-N","Laguna","N","3/10/22",3,"B","341","epibou","epibou","epibou","epibou","2",1.6,"Y","Y","N","298",NA,NA,NA,2022-10-03,"2022"
"341","JS-N","Laguna","N","3/10/22",3,"C","342","epibou","epibou","epibou","epibou","2",1.7,"Y","Y","N","298",NA,NA,NA,2022-10-03,"2022"
"342","JS-N","Laguna","N","3/10/22",4,"A","343","priach","priach","priach","priach","2",2.6,"Y","Y","N","316",NA,NA,NA,2022-10-03,"2022"
"343","JS-N","Laguna","N","3/10/22",4,"C","344","priach","priach","priach","priach","2",2.7,"Y","Y","N","316",NA,NA,NA,2022-10-03,"2022"
"344","FLL-C","Laguna","C","5/10/22",1,"A","345","priach","priach","priach","priach","3",2.5,"Y","Y","N","345",NA,NA,NA,2022-10-05,"2022"
"345","FLL-C","Laguna","C","5/10/22",1,"A","346","priach","priach","priach","priach","3",2.9,"Y","Y","N","346",NA,NA,NA,2022-10-05,"2022"
"346","FLL-C","Laguna","C","5/10/22",1,"A","347","priach","priach","priach","priach","3",3.6,"Y","Y","N","346",NA,NA,NA,2022-10-05,"2022"
"347","FLL-C","Laguna","C","5/10/22",1,"B","348","priach","priach","priach","priach","3",2.6,"Y","Y","N","348",NA,NA,NA,2022-10-05,"2022"
"348","FLL-C","Laguna","C","5/10/22",1,"D","349","priach","priach","priach","priach","3",2.7,"Y","Y","N","349",NA,NA,NA,2022-10-05,"2022"
"349","FLL-C","Laguna","C","5/10/22",1,"D","350","priach","priach","priach","priach","3",3.5,"Y","Y","N","R55",NA,NA,NA,2022-10-05,"2022"
"350","FLL-C","Laguna","C","5/10/22",2,"B","351","priach","priach","priach","priach","3",3.5,"Y","Y","N","351",NA,NA,NA,2022-10-05,"2022"
"351","FLL-C","Laguna","C","5/10/22",2,"B","352","priach","priach","priach","priach","3",2.5,"Y","Y","N","352",NA,NA,NA,2022-10-05,"2022"
"352","FLL-C","Laguna","C","5/10/22",2,"C","353","priach","priach","priach","priach","3",3.6,"Y","Y","N","346",NA,NA,NA,2022-10-05,"2022"
"353","FLL-C","Laguna","C","5/10/22",2,"D","354","priach","priach","priach","priach","3",2.2,"Y","Y","N","354",NA,NA,NA,2022-10-05,"2022"
"354","FLL-C","Laguna","C","5/10/22",3,"A","355","priach","priach","priach","priach","3",2.6,"Y","Y","N","345",NA,NA,NA,2022-10-05,"2022"
"355","FLL-C","Laguna","C","5/10/22",3,"B","356","priach","priach","priach","priach","3",2.6,"Y","Y","N","356",NA,NA,NA,2022-10-05,"2022"
"356","FLL-C","Laguna","C","5/10/22",3,"C","357","priach","priach","priach","priach","3",2.6,"Y","Y","N","348",NA,NA,NA,2022-10-05,"2022"
"357","FLL-C","Laguna","C","5/10/22",3,"D","358","priach","priach","priach","priach","3",2.5,"Y","Y","N","352",NA,NA,NA,2022-10-05,"2022"
"358","FLL-C","Laguna","C","5/10/22",4,"C","359","priach","priach","priach","priach","3",2.5,"Y","Y","N","359",NA,NA,NA,2022-10-05,"2022"
"359","FLL-C","Laguna","C","5/10/22",4,"C","360","priach","priach","priach","priach","3",2.3,"Y","Y","N","346",NA,NA,NA,2022-10-05,"2022"
"360","FLL-C","Laguna","C","5/10/22",4,"D","361","priach","priach","priach","priach","3",2.2,"Y","Y","N","361",NA,NA,NA,2022-10-05,"2022"
"361","FLL-V","Laguna","V","5/10/22",1,"A","362","priach","priach","priach","priach","20",2.9,"Y","Y","N","354",NA,NA,NA,2022-10-05,"2022"
"362","FLL-V","Laguna","V","5/10/22",1,"B","363","priach","priach","priach","priach","20",2.8,"Y","Y","N","363",NA,NA,NA,2022-10-05,"2022"
"363","FLL-V","Laguna","V","5/10/22",1,"B","364","barpul","barpul","barpul","barpul","20",2.2,"Y","Y","N","364",NA,"infeccion en la piel, foto correcta",NA,2022-10-05,"2022"
"364","FLL-V","Laguna","V","5/10/22",1,"B","365","barpul","barpul","barpul","barpul","20",2.2,"Y","Y","N","365",NA,NA,NA,2022-10-05,"2022"
"365","FLL-V","Laguna","V","5/10/22",1,"C","366","priach","priach","priach","priach","20",3.7,"Y","Y","N","366",NA,NA,NA,2022-10-05,"2022"
"366","FLL-V","Laguna","V","5/10/22",1,"C","367","barpul","barpul","barpul","barpul","20",2.7,"Y","Y","N","367",NA,NA,NA,2022-10-05,"2022"
"367","FLL-V","Laguna","V","5/10/22",1,"C","368","priach","priach","priach","priach","20",3.9,"Y","Y","N","346",NA,NA,NA,2022-10-05,"2022"
"368","FLL-V","Laguna","V","5/10/22",1,"D","369","barpul","barpul","barpul","barpul","20",2.7,"Y","Y","N","367",NA,NA,NA,2022-10-05,"2022"
"369","FLL-V","Laguna","V","5/10/22",1,"D","370","priach","priach","priach","priach","20",2.7,"Y","Y","N","370",NA,NA,NA,2022-10-05,"2022"
"370","FLL-V","Laguna","V","5/10/22",1,"D","371","barpul","barpul","barpul","barpul","20",2.4,"Y","Y","N","365",NA,NA,NA,2022-10-05,"2022"
"371","FLL-V","Laguna","V","5/10/22",2,"A","372","priach","priach","priach","priach","20",3.2,"Y","Y","N","370",NA,NA,NA,2022-10-05,"2022"
"372","FLL-V","Laguna","V","5/10/22",2,"B","373","priach","priach","priach","priach","20",2.9,"Y","Y","N","359",NA,NA,NA,2022-10-05,"2022"
"373","FLL-V","Laguna","V","5/10/22",2,"C","374","priach","priach","priach","priach","20",3.7,"Y","Y","N","359",NA,NA,NA,2022-10-05,"2022"
"374","FLL-V","Laguna","V","5/10/22",2,"C","375","barpul","barpul","barpul","barpul","20",2.5,"Y","Y","N","365",NA,NA,NA,2022-10-05,"2022"
"375","FLL-V","Laguna","V","5/10/22",2,"D","376","priach","priach","priach","priach","20",3.9,"Y","Y","N","346",NA,NA,NA,2022-10-05,"2022"
"376","FLL-V","Laguna","V","5/10/22",3,"A","377","priach","priach","priach","priach","20",2.4,"Y","Y","N","346",NA,NA,NA,2022-10-05,"2022"
"377","FLL-V","Laguna","V","5/10/22",3,"A","378","epibou","epibou","epibou","epibou","20",1.6,"Y","Y","N","378",NA,NA,NA,2022-10-05,"2022"
"378","FLL-V","Laguna","V","5/10/22",3,"A","379","epibou","epibou","epibou","epibou","20",1.5,"Y","Y","N","378",NA,NA,NA,2022-10-05,"2022"
"379","FLL-V","Laguna","V","5/10/22",3,"A","380","priach","priach","priach","priach","20",2.7,"Y","Y","N","345",NA,NA,NA,2022-10-05,"2022"
"380","FLL-V","Laguna","V","5/10/22",3,"B","381","barpul","barpul","barpul","barpul","20",2.3,"Y","Y","N","365",NA,NA,NA,2022-10-05,"2022"
"381","FLL-V","Laguna","V","5/10/22",3,"B","382","priach","priach","priach","priach","20",4.1,"Y","Y","N","382",NA,NA,NA,2022-10-05,"2022"
"382","FLL-V","Laguna","V","5/10/22",3,"C","383","priach","priach","priach","priach","20",2.4,"Y","Y","N","383",NA,NA,NA,2022-10-05,"2022"
"383","FLL-V","Laguna","V","5/10/22",3,"C","384","barpul","barpul","barpul","barpul","20",2.6,"Y","Y","N","367",NA,NA,NA,2022-10-05,"2022"
"384","FLL-V","Laguna","V","5/10/22",4,"A","385","barpul","barpul","barpul","barpul","20",2.7,"Y","Y","N","367",NA,NA,NA,2022-10-05,"2022"
"385","FLL-V","Laguna","V","5/10/22",4,"A","386","scisug","scisug","scisig","scisig","20",4.4,"Y","Y","N","386",NA,"Scinax sugillatus?",NA,2022-10-05,"2022"
"386","FLL-V","Laguna","V","5/10/22",4,"B","387","priach","priach","priach","priach","20",4,"Y","Y","N","345",NA,NA,NA,2022-10-05,"2022"
"387","FLL-B","Laguna","B","5/10/22",1,"D","388","priach","priach","priach","priach","5",2.8,"Y","Y","N","388",NA,NA,NA,2022-10-05,"2022"
"388","FLL-B","Laguna","B","5/10/22",1,"D","389","priach","priach","priach","priach","5",3,"Y","Y","N","389",NA,NA,NA,2022-10-05,"2022"
"389","FLL-B","Laguna","B","5/10/22",1,"D","390","priach","priach","priach","priach","5",2.7,"Y","Y","N","390",NA,NA,NA,2022-10-05,"2022"
"390","FLL-B","Laguna","B","5/10/22",2,"A","391","priach","priach","priach","priach","5",2.4,"Y","Y","N","359",NA,NA,NA,2022-10-05,"2022"
"391","FLL-B","Laguna","B","5/10/22",2,"B","392","priach","priach","priach","priach","5",2.7,"Y","Y","N","389",NA,NA,NA,2022-10-05,"2022"
"392","FLL-B","Laguna","B","5/10/22",2,"D","393","priach","priach","priach","priach","5",2.9,"Y","Y","N","393",NA,NA,NA,2022-10-05,"2022"
"393","FLL-B","Laguna","B","5/10/22",4,"B","394","priach","priach","priach","priach","5",3.4,"Y","Y","N","394",NA,NA,NA,2022-10-05,"2022"
"394","JS-N","Laguna","N","5/10/22",1,"A","395","barpul","barpul","barpul","barpul","5",1.9,"Y","Y","N","365",NA,NA,NA,2022-10-05,"2022"
"395","JS-N","Laguna","N","5/10/22",1,"B","396","priach","priach","priach","priach","5",2.3,"Y","Y","N","396",NA,NA,NA,2022-10-05,"2022"
"396","JS-N","Laguna","N","5/10/22",1,"C","397","denebr","boaros","denebr","denebr","5",2.4,"Y","Y","N","397",NA,"Dendropsophus ebraccatus? Boana rosenebergi for FVE",NA,2022-10-05,"2022"
"397","JS-N","Laguna","N","5/10/22",3,"B","398","epibou","epibou","epibou","epibou","5",1.5,"Y","Y","N","378",NA,NA,NA,2022-10-05,"2022"
"398","FLL-C","Laguna","C","7/10/22",1,"B","399","priach","priach","priach","priach","3",2.1,"Y","Y","N","399",NA,NA,NA,2022-10-07,"2022"
"399","FLL-C","Laguna","C","7/10/22",1,"B","400","priach","priach","priach","priach","3",2.9,"Y","Y","N","400",NA,NA,NA,2022-10-07,"2022"
"400","FLL-C","Laguna","C","7/10/22",1,"C","401","priach","priach","priach","priach","3",2.6,"Y","Y","N","401",NA,NA,NA,2022-10-07,"2022"
"401","FLL-C","Laguna","C","7/10/22",2,"C","402","priach","priach","priach","priach","3",3.6,"Y","Y","N","402",NA,NA,NA,2022-10-07,"2022"
"402","FLL-C","Laguna","C","7/10/22",2,"C","403","priach","priach","priach","priach","3",1.6,"Y","Y","N","403",NA,NA,NA,2022-10-07,"2022"
"403","FLL-C","Laguna","C","7/10/22",2,"D","404","scitsa","scitsa","boapel","boapel","3",2.7,"Y","Y","N","404",NA,NA,NA,2022-10-07,"2022"
"404","FLL-C","Laguna","C","7/10/22",2,"D","405","priach","priach","priach","priach","3",2.7,"Y","Y","N","R66",NA,NA,NA,2022-10-07,"2022"
"405","FLL-C","Laguna","C","7/10/22",3,"A","406","priach","priach","priach","priach","3",4.2,"Y","Y","N","401",NA,NA,NA,2022-10-07,"2022"
"406","FLL-C","Laguna","C","7/10/22",3,"A","407","priach","priach","priach","priach","3",3.9,"Y","Y","N","401",NA,"dedo deformado",NA,2022-10-07,"2022"
"407","FLL-C","Laguna","C","7/10/22",3,"A","408","scitsa","scitsa","boapel","boapel","3",2.5,"Y","Y","N","404",NA,NA,NA,2022-10-07,"2022"
"408","FLL-C","Laguna","C","7/10/22",3,"B","409","priach","priach","priach","priach","3",2.6,"Y","Y","N","409",NA,NA,NA,2022-10-07,"2022"
"409","FLL-C","Laguna","C","7/10/22",4,"A","410","priach","priach","priach","priach","3",3,"Y","Y","N","410","muerto","murio",NA,2022-10-07,"2022"
"410","FLL-C","Laguna","C","7/10/22",4,"B","411","priach","priach","priach","priach","33",4.2,"Y","Y","N","411",NA,NA,NA,2022-10-07,"2022"
"411","FLL-C","Laguna","C","7/10/22",4,"B","412","priach","priach","priach","priach","3",4,"Y","Y","N","412",NA,NA,NA,2022-10-07,"2022"
"412","FLL-C","Laguna","C","7/10/22",4,"C","413","barpul","barpul","barpul","barpul","3",3.5,"Y","Y","N","413",NA,NA,NA,2022-10-07,"2022"
"413","FLL-C","Laguna","C","7/10/22",4,"C","414","scitsa","scitsa","scitsa","scitsa","3",1.7,"Y","Y","N","414",NA,"not sure species ID/creeria que si es scitsa(DFM)",NA,2022-10-07,"2022"
"414","FLL-V","Laguna","V","7/10/22",1,"B","415","priach","priach","priach","priach","20",3.7,"Y","Y","N","400",NA,NA,NA,2022-10-07,"2022"
"415","FLL-V","Laguna","V","7/10/22",2,"A","416","priach","priach","priach","priach","20",2.3,"Y","Y","N","416",NA,NA,NA,2022-10-07,"2022"
"416","FLL-V","Laguna","V","7/10/22",2,"D","417","priach","priach","priach","priach","20",2.4,"Y","Y","N","R70",NA,NA,NA,2022-10-07,"2022"
"417","FLL-V","Laguna","V","7/10/22",2,"D","418","priach","priach","priach","priach","20",4.3,"Y","Y","N","418",NA,NA,NA,2022-10-07,"2022"
"418","FLL-V","Laguna","V","7/10/22",3,"B","419","epibou","epibou","epibou","epibou","20",1.5,"Y","Y","N","419",NA,NA,NA,2022-10-07,"2022"
"419","FLL-V","Laguna","V","7/10/22",3,"B","420","epibou","epibou","epibou","epibou","20",1.6,"Y","Y","N","419",NA,NA,NA,2022-10-07,"2022"
"420","FLL-V","Laguna","V","7/10/22",3,"B","421","priach","priach","priach","priach","20",4,"Y","Y","N","421",NA,NA,NA,2022-10-07,"2022"
"421","FLL-V","Laguna","V","7/10/22",3,"C","422","barpul","barpul","priach","priach","20",2.2,"Y","Y","N","413",NA,NA,NA,2022-10-07,"2022"
"422","FLL-V","Laguna","V","7/10/22",4,"A","423","barpul","barpul","barpul","barpul","20",2.4,"Y","Y","N","413",NA,NA,NA,2022-10-07,"2022"
"423","FLL-V","Laguna","V","7/10/22",4,"B","424","priach","priach","priach","priach","20",2.2,"Y","Y","N","424",NA,NA,NA,2022-10-07,"2022"
"424","FLL-V","Laguna","V","7/10/22",4,"B","425","barpul","barpul","barpul","barpul","20",2.2,"Y","Y","N","413",NA,NA,NA,2022-10-07,"2022"
"425","FLL-V","Laguna","V","7/10/22",4,"C","426","priach","priach","priach","priach","20",3.6,"Y","Y","N","426",NA,NA,NA,2022-10-07,"2022"
"426","JS-N","Laguna","N","7/10/22",1,"B","427","barpul","barpul","barpul","barpul","2",2.1,"Y","Y","N","427",NA,NA,NA,2022-10-07,"2022"
"427","JS-N","Laguna","N","7/10/22",2,"A","428","priach","priach","priach","priach","2",2.7,"Y","Y","N","428",NA,NA,NA,2022-10-07,"2022"
"428","JS-N","Laguna","N","7/10/22",2,"C","429","priach","priach","priach","priach","2",3.8,"Y","Y","N","429",NA,NA,NA,2022-10-07,"2022"
"429","JS-N","Laguna","N","7/10/22",3,"A","430","epibou","epibou","epibou","epibou","2",1.7,"Y","Y","N","414",NA,NA,NA,2022-10-07,"2022"
"430","JS-N","Laguna","N","7/10/22",3,"C","431","barpul","barpul","barpul","barpul","2",2,"Y","Y","N","413",NA,NA,NA,2022-10-07,"2022"
"431","JS-N","Laguna","N","7/10/22",4,"A","432","barpul","barpul","barpul","barpul","2",2.6,"Y","Y","N","413",NA,NA,NA,2022-10-07,"2022"
"432","JS-N","Laguna","N","7/10/22",4,"B","433","priach","priach","priach","priach","2",2.9,"Y","Y","N","433",NA,NA,NA,2022-10-07,"2022"
"433","FLL-B","Laguna","B","7/10/22",2,"C","434","priach","priach","priach","priach","5",2.7,"Y","Y","N","434",NA,NA,NA,2022-10-07,"2022"
"434","DB-N","Laguna","N","8/10/22",1,"A","435","priach","priach","priach","priach","40",2.6,"Y","Y","N","435",NA,NA,NA,2022-10-08,"2022"
"435","DB-N","Laguna","N","8/10/22",1,"B","436","priach","priach","priach","priach","40",2.9,"Y","Y","N","436",NA,NA,NA,2022-10-08,"2022"
"436","DB-N","Laguna","N","8/10/22",1,"C","437","boapel","boapel","boapel","boapel","40",4.5,"Y","Y","N","437",NA,NA,NA,2022-10-08,"2022"
"437","DB-N","Laguna","N","8/10/22",1,"D","438","boapel","boapel","boapel","boapel","40",3.7,"Y","Y","N","438",NA,NA,NA,2022-10-08,"2022"
"438","DB-N","Laguna","N","8/10/22",1,"D","439","scitsa","scitsa","boapel","boapel","40",3,"Y","Y","N","439",NA,NA,NA,2022-10-08,"2022"
"439","DB-N","Laguna","N","8/10/22",1,"D","440","boapel","boapel","boapel","boapel","40",5,"Y","Y","N","440",NA,NA,NA,2022-10-08,"2022"
"440","DB-N","Laguna","N","8/10/22",2,"A","441","boapel","boapel","boapel","boapel","40",4.7,"Y","Y","N","441",NA,NA,NA,2022-10-08,"2022"
"441","DB-N","Laguna","N","8/10/22",2,"A","442","boapel","boapel","boapel","boapel","40",5.3,"Y","Y","N","442","muerto","murio",NA,2022-10-08,"2022"
"442","DB-N","Laguna","N","8/10/22",2,"A","443","priach","priach","priach","priach","40",4.2,"Y","Y","N","443",NA,NA,NA,2022-10-08,"2022"
"443","DB-N","Laguna","N","8/10/22",2,"A","444","priach","priach","priach","priach","40",3.4,"Y","Y","N","444",NA,NA,NA,2022-10-08,"2022"
"444","DB-N","Laguna","N","8/10/22",2,"A","445","priach","priach","priach","priach","40",3.7,"Y","Y","N","436",NA,NA,NA,2022-10-08,"2022"
"445","DB-N","Laguna","N","8/10/22",2,"B","446","scitsa","scitsa","scitsa","scitsa","40",3.5,"Y","Y","N","446",NA,NA,NA,2022-10-08,"2022"
"446","DB-N","Laguna","N","8/10/22",2,"B","447","priach","priach","priach","priach","40",3.1,"Y","Y","N","447",NA,NA,NA,2022-10-08,"2022"
"447","DB-N","Laguna","N","8/10/22",2,"B","448","boapel","boapel","boapel","boapel","40",4.5,"Y","Y","N","448",NA,NA,NA,2022-10-08,"2022"
"448","DB-N","Laguna","N","8/10/22",2,"C","449","priach","priach","priach","priach","4040",2.9,"Y","Y","N","449",NA,NA,NA,2022-10-08,"2022"
"449","DB-N","Laguna","N","8/10/22",2,"D","450","priach","priach","priach","priach","40",2.7,"Y","Y","N","450",NA,NA,NA,2022-10-08,"2022"
"450","DB-N","Laguna","N","8/10/22",2,"D","451","barpul","barpul","barpul","barpul","4040",2.7,"Y","Y","N","451",NA,NA,NA,2022-10-08,"2022"
"451","DB-N","Laguna","N","8/10/22",3,"A","452","boapel","boapel","boapel","boapel","40",5.5,"Y","Y","N","452",NA,NA,NA,2022-10-08,"2022"
"452","DB-N","Laguna","N","8/10/22",3,"B","453","priach","priach","priach","priach","40",2.8,"Y","Y","N","453",NA,NA,NA,2022-10-08,"2022"
"453","DB-N","Laguna","N","8/10/22",3,"B","454","priwal","priwal","priwal","priwal","40",3.8,"Y","Y","N","454",NA,"pristimantis walkeri",NA,2022-10-08,"2022"
"454","DB-N","Laguna","N","8/10/22",3,"C","455","priach","priach","priach","priach","40",2.6,"Y","Y","N","455",NA,NA,NA,2022-10-08,"2022"
"455","DB-N","Laguna","N","8/10/22",3,"C","456","priach","priach","priach","priach","40",3,"Y","Y","N","456",NA,NA,NA,2022-10-08,"2022"
"456","DB-N","Laguna","N","8/10/22",4,"A","457","priach","priach","priach","priach","40",2.6,"Y","Y","N","457",NA,NA,NA,2022-10-08,"2022"
"457","DB-N","Laguna","N","8/10/22",4,"A","458","priach","priach","priach","priach","40",2.9,"Y","Y","N","458",NA,NA,NA,2022-10-08,"2022"
"458","DB-N","Laguna","N","8/10/22",4,"A","459","priach","priach","priach","priach","40",2.7,"Y","Y","N","459",NA,NA,NA,2022-10-08,"2022"
"459","DB-N","Laguna","N","8/10/22",4,"B","460","priach","priach","priach","priach","40",4.1,"Y","Y","N","460",NA,NA,NA,2022-10-08,"2022"
"460","DB-N","Laguna","N","8/10/22",4,"B","461","scitsa","scitsa","boapel","boapel","40",2.3,"Y","Y","N","439",NA,NA,NA,2022-10-08,"2022"
"461","DB-N","Laguna","N","8/10/22",4,"C","462","priach","priach","priach","priach","40",2.9,"Y","Y","N","462",NA,NA,NA,2022-10-08,"2022"
"462","DB-N","Laguna","N","8/10/22",4,"D","463","cralon","cralon","cralon","cralon","40",3.8,"Y","Y","N","463",NA,"craugastor longirostris",NA,2022-10-08,"2022"
"463","DB-C","Laguna","C","8/10/22",1,"B","464","boapel","boapel","boapel","boapel","30",4.7,"Y","Y","N","464",NA,NA,NA,2022-10-08,"2022"
"464","DB-C","Laguna","C","8/10/22",2,"A","465","priach","priach","priach","priach","30",3.7,"Y","Y","N","465",NA,NA,NA,2022-10-08,"2022"
"465","DB-C","Laguna","C","8/10/22",2,"B","466","priach","priach","priach","priach","30",3.4,"Y","Y","N","466",NA,NA,NA,2022-10-08,"2022"
"466","DB-C","Laguna","C","8/10/22",2,"C","467","priach","priach","priach","priach","30",3,"Y","Y","N","467",NA,NA,NA,2022-10-08,"2022"
"467","DB-C","Laguna","C","8/10/22",3,"A","468","scitsa","scitsa","boapel","boapel","30",2.7,"Y","Y","N","439",NA,NA,NA,2022-10-08,"2022"
"468","DB-C","Laguna","C","8/10/22",3,"A","469","scitsa","scitsa","boapel","boapel","30",2.5,"Y","Y","N","439",NA,NA,NA,2022-10-08,"2022"
"469","DB-C","Laguna","C","8/10/22",4,"D","470","scitsa","scitsa","boapel","boapel","30",2.4,"Y","Y","N","439",NA,NA,NA,2022-10-08,"2022"
"470","DB-C","Laguna","C","8/10/22",4,"D","471","barpul","barpul","barpul","barpul","30",2.7,"Y","Y","N","451",NA,NA,NA,2022-10-08,"2022"
"471","DB-N","Laguna","N","10/10/22",1,"C","472","boapel","boapel","boapel","boapel","40",4,"Y","Y","N","472",NA,NA,NA,2022-10-10,"2022"
"472","DB-N","Laguna","N","10/10/22",1,"C","473","priach","priach","priach","priach","40",3.1,"Y","Y","N","473",NA,NA,NA,2022-10-10,"2022"
"473","DB-N","Laguna","N","10/10/22",1,"D","474","priach","priach","priach","priach","40",1.7,"Y","Y","N","474",NA,NA,NA,2022-10-10,"2022"
"474","DB-N","Laguna","N","10/10/22",2,"A","475","barpul","barpul","barpul","barpul","40",2.3,"Y","Y","N","475",NA,NA,NA,2022-10-10,"2022"
"475","DB-N","Laguna","N","10/10/22",2,"C","476","boapel","boapel","boapel","boapel","40",5.3,"Y","Y","N","476",NA,NA,NA,2022-10-10,"2022"
"476","DB-N","Laguna","N","10/10/22",2,"C","477","barpul","barpul","barpul","barpul","40",2.5,"Y","Y","N","475","muerto","murio",NA,2022-10-10,"2022"
"477","DB-N","Laguna","N","10/10/22",2,"D","478","scitsa","scitsa","boapel","boapel","40",4.2,"Y","Y","N","478",NA,NA,NA,2022-10-10,"2022"
"478","DB-N","Laguna","N","10/10/22",2,"D","479","boapel","boapel","boapel","boapel","40",4.3,"Y","Y","N","476",NA,NA,NA,2022-10-10,"2022"
"479","DB-N","Laguna","N","10/10/22",3,"C","480","barpul","barpul","barpul","barpul","40",2.2,"Y","Y","N","480",NA,NA,NA,2022-10-10,"2022"
"480","DB-N","Laguna","N","10/10/22",3,"C","481","priach","priach","priach","priach","40",3.6,"Y","Y","N","481",NA,NA,NA,2022-10-10,"2022"
"481","DB-N","Laguna","N","10/10/22",3,"D","482","barpul","barpul","barpul","barpul","40",2.5,"Y","Y","N","475",NA,NA,NA,2022-10-10,"2022"
"482","DB-N","Laguna","N","10/10/22",3,"D","483","barpul","barpul","barpul","barpul","40",5.1,"Y","Y","N","476",NA,NA,NA,2022-10-10,"2022"
"483","DB-N","Laguna","N","10/10/22",4,"B","484","priach","priach","priach","priach","40",4.3,"Y","Y","N","473",NA,NA,NA,2022-10-10,"2022"
"484","DB-N","Laguna","N","10/10/22",4,"C","485","priach","priach","priach","priach","40",2.3,"Y","Y","N","485",NA,NA,NA,2022-10-10,"2022"
"485","DB-N","Laguna","N","10/10/22",4,"C","486","scitsa","scisug","boapel","boapel","40",2.6,"Y","Y","N","486",NA,NA,NA,2022-10-10,"2022"
"486","DB-N","Laguna","N","10/10/22",4,"C","487","priach","priach","priach","priach","40",3,"Y","Y","N","487",NA,NA,NA,2022-10-10,"2022"
"487","DB-N","Laguna","N","10/10/22",4,"D","488","barpul","barpul","barpul","barpul","40",2.3,"Y","Y","N","475",NA,NA,NA,2022-10-10,"2022"
"488","DB-C","Laguna","C","10/10/22",1,"A","489","scitsa","scitsa","boapel","boapel","30",2.4,"Y","Y","N","486",NA,NA,NA,2022-10-10,"2022"
"489","DB-C","Laguna","C","10/10/22",1,"A","490","scitsa","scitsa","boapel","boapel","30",1.9,"Y","Y","N","486",NA,NA,NA,2022-10-10,"2022"
"490","DB-C","Laguna","C","10/10/22",1,"B","491","scitsa","scitsa","boapel","boapel","30",2.1,"Y","Y","N","486",NA,NA,NA,2022-10-10,"2022"
"491","DB-C","Laguna","C","10/10/22",1,"C","492","priach","priach","priach","priach","30",4.5,"Y","Y","N","473",NA,NA,NA,2022-10-10,"2022"
"492","DB-C","Laguna","C","10/10/22",2,"A","493","scitsa","scitsa","boapel","boapel","30",2.3,"Y","Y","N","486",NA,NA,NA,2022-10-10,"2022"
"493","DB-C","Laguna","C","10/10/22",2,"C","494","scitsa","scitsa","boapel","boapel","30",2.5,"Y","Y","N","486",NA,NA,NA,2022-10-10,"2022"
"494","DB-C","Laguna","C","10/10/22",2,"C","495","scitsa","scitsa","boapel","boapel","30",3.8,"Y","Y","N","486",NA,NA,NA,2022-10-10,"2022"
"495","DB-C","Laguna","C","10/10/22",2,"C","496","scitsa","scitsa","boapel","boapel","30",2.3,"Y","Y","N","486",NA,NA,NA,2022-10-10,"2022"
"496","DB-C","Laguna","C","10/10/22",2,"D","497","scitsa","boa?","boapel","boapel","30",2.7,"Y","Y","N","486",NA,NA,NA,2022-10-10,"2022"
"497","DB-C","Laguna","C","10/10/22",3,"A","498","scitsa","priach","boapel","boapel","30",2.7,"Y","Y","N","486",NA,NA,NA,2022-10-10,"2022"
"498","DB-C","Laguna","C","10/10/22",3,"B","499","scitsa","priach","boapel","boapel","30",2.3,"Y","Y","N","486",NA,NA,NA,2022-10-10,"2022"
"499","DB-C","Laguna","C","10/10/22",4,"C","500","scitsa","priach","boapel","boapel","30",3.5,"Y","Y","N","486",NA,NA,NA,2022-10-10,"2022"
"500","DB-C","Laguna","C","10/10/22",4,"D","501","scitsa","priach","boapel","boapel","30",3.5,"Y","Y","N","486",NA,NA,NA,2022-10-10,"2022"
"501","DB-N","Laguna","N","12/10/22",2,"A","502","barpul","barpul","barpul","barpul","40",2,"Y","Y","N","502",NA,NA,NA,2022-10-12,"2022"
"502","DB-N","Laguna","N","12/10/22",2,"B","503","priach","priach","priach","priach","40",2.3,"Y","Y","N","503",NA,NA,NA,2022-10-12,"2022"
"503","DB-N","Laguna","N","12/10/22",2,"B","504","boapel","boapel","boapel","boapel","40",4.6,"Y","Y","N","504",NA,NA,NA,2022-10-12,"2022"
"504","DB-N","Laguna","N","12/10/22",2,"C","505","priach","priach","priach","priach","40",3.4,"Y","Y","N","505",NA,NA,NA,2022-10-12,"2022"
"505","DB-N","Laguna","N","12/10/22",2,"D","506","boapel","boapel","boapel","boapel","40",4.5,"Y","Y","N","506",NA,NA,NA,2022-10-12,"2022"
"506","DB-N","Laguna","N","12/10/22",3,"A","507","priach","priach","priach","priach","40",4.2,"Y","Y","N","507",NA,NA,NA,2022-10-12,"2022"
"507","DB-N","Laguna","N","12/10/22",3,"B","508","priach","priach","priach","priach","40",2.7,"Y","Y","N","505",NA,NA,NA,2022-10-12,"2022"
"508","DB-N","Laguna","N","12/10/22",3,"B","509","priach","priach","priach","priach","40",3.5,"Y","Y","N","509",NA,NA,NA,2022-10-12,"2022"
"509","DB-N","Laguna","N","12/10/22",3,"B","510","priach","priach","priach","priach","40",2.3,"Y","Y","N","505",NA,NA,NA,2022-10-12,"2022"
"510","DB-N","Laguna","N","12/10/22",3,"C","511","priach","priach","priach","priach","40",4.2,"Y","Y","N","507",NA,NA,NA,2022-10-12,"2022"
"511","DB-N","Laguna","N","12/10/22",3,"C","512","barpul","barpul","priach","priach","40",2.3,"Y","Y","N","502",NA,NA,NA,2022-10-12,"2022"
"512","DB-N","Laguna","N","12/10/22",4,"C","513","scitsa","scitsa","boapel","boapel","40",3.5,"Y","Y","N","R88",NA,NA,NA,2022-10-12,"2022"
"513","DB-N","Laguna","N","12/10/22",4,"C","514","priach","priach","priach","priach","40",2.3,"Y","Y","N","509",NA,NA,NA,2022-10-12,"2022"
"514","DB-N","Laguna","N","12/10/22",4,"D","515","priach","priach","priach","priach","40",3.7,"Y","Y","N","505",NA,NA,NA,2022-10-12,"2022"
"515","DB-C","Laguna","C","12/10/22",2,"A","516","scitsa","scitsa","boapel","boapel","30",2.6,"Y","Y","N","R88",NA,NA,NA,2022-10-12,"2022"
"516","DB-C","Laguna","C","12/10/22",2,"A","517","scitsa","scitsa","boapel","boapel","30",2.5,"Y","Y","N","R88",NA,NA,NA,2022-10-12,"2022"
"517","DB-C","Laguna","C","12/10/22",2,"B","518","scitsa","scitsa","boapel","boapel","30",2.7,"Y","Y","N","R88",NA,NA,NA,2022-10-12,"2022"
"518","DB-C","Laguna","C","12/10/22",2,"D","519","scitsa","scitsa","boapel","boapel","30",2.5,"Y","Y","N","R88",NA,NA,NA,2022-10-12,"2022"
"519","DB-C","Laguna","C","12/10/22",4,"A","520","boapel","boapel","boapel","boapel","30",5.4,"Y","Y","N","520",NA,NA,NA,2022-10-12,"2022"
"520","DG-B","Gavilanes","B","6/11/22",1,"A","521","cralon","cralon","cralon","cralon","5",2.6,"Y","Y","N","521",NA,NA,NA,2022-11-06,"2022"
"521","DG-B","Gavilanes","B","6/11/22",1,"B","522","priach","priach","priach","priach","5",3.6,"Y","Y","N","522",NA,NA,NA,2022-11-06,"2022"
"522","DG-B","Gavilanes","B","6/11/22",1,"C","523","epibou","epibou","epibou","epibou","5",1.7,"Y","Y","N","523",NA,NA,NA,2022-11-06,"2022"
"523","DG-B","Gavilanes","B","6/11/22",1,"D","524","priach","priach","priach","priach","5",3,"Y","Y","N","522",NA,NA,NA,2022-11-06,"2022"
"524","DG-B","Gavilanes","B","6/11/22",1,"D","525","priwal","pri?","priach","priach","5",3.6,"Y","Y","N","525","colectado","P. walkeri? llevado a la estacion",NA,2022-11-06,"2022"
"525","DG-B","Gavilanes","B","6/11/22",1,"D","526","cralon","cralon","cralon","cralon","5",3.1,"Y","Y","N","521",NA,NA,NA,2022-11-06,"2022"
"526","DG-B","Gavilanes","B","6/11/22",4,"A","527","cralon","cralon","cralon","cralon","5",2.6,"Y","Y","N","527",NA,NA,NA,2022-11-06,"2022"
"527","DG-B","Gavilanes","B","6/11/22",4,"A","528","rhiala","rhiala","rhiala","rhiala","5",3.5,"Y","Y","N","528",NA,NA,NA,2022-11-06,"2022"
"528","DG-B","Gavilanes","B","6/11/22",4,"A","529","priach","priach","priach","priach","5",4.2,"Y","Y","N","529",NA,NA,NA,2022-11-06,"2022"
"529","DG-B","Gavilanes","B","6/11/22",4,"B","530","priach","priach","priach","priach","5",2.9,"Y","Y","N","530",NA,NA,NA,2022-11-06,"2022"
"530","DG-V","Gavilanes","V","6/11/22",1,"A","531","priach","priach","priach","priach","0020 + 0005 + 0002",2.6,"Y","Y","N","531",NA,NA,NA,2022-11-06,"2022"
"531","DG-V","Gavilanes","V","6/11/22",1,"A","532","priach","priach","priach","priach","0020 + 0005 + 0002",2.2,"Y","Y","N","522",NA,NA,NA,2022-11-06,"2022"
"532","DG-V","Gavilanes","V","6/11/22",1,"B","533","priach","priach","priach","priach","0020 + 0005 + 0002",2.9,"Y","Y","N","533",NA,NA,NA,2022-11-06,"2022"
"533","DG-V","Gavilanes","V","6/11/22",1,"D","534","priach","priach","priach","priach","0020 + 0005 + 0002",3.7,"Y","Y","N","534",NA,NA,NA,2022-11-06,"2022"
"534","DG-V","Gavilanes","V","6/11/22",2,"B","535","priach","priach","priach","priach","0020 + 0005 + 0002",2.9,"Y","Y","N","535",NA,NA,NA,2022-11-06,"2022"
"535","DG-V","Gavilanes","V","6/11/22",2,"B","536","priach","priach","priach","priach","0020 + 0005 + 0002",2.6,"Y","Y","N","536",NA,NA,NA,2022-11-06,"2022"
"536","DG-V","Gavilanes","V","6/11/22",2,"B","537","priach","priach","priach","priach","0020 + 0005 + 0002",2.7,"Y","Y","N","537",NA,NA,NA,2022-11-06,"2022"
"537","DG-V","Gavilanes","V","6/11/22",2,"D","538","priach","priach","priach","priach","0020 + 0005 + 0002",3.9,"Y","Y","N","538",NA,"escapo uno del 2C",NA,2022-11-06,"2022"
"538","DG-V","Gavilanes","V","6/11/22",3,"A","539","priach","priach","priach","priach","20",2.6,"Y","Y","N","539",NA,NA,NA,2022-11-06,"2022"
"539","DG-V","Gavilanes","V","6/11/22",3,"B","540","epibou","epibou","epibou","epibou","20",1.6,"Y","Y","N","523",NA,NA,NA,2022-11-06,"2022"
"540","DG-V","Gavilanes","V","6/11/22",3,"B","541","cralon","cralon","cralon","cralon","20",3.9,"Y","Y","N","521",NA,"no tiene una pata",NA,2022-11-06,"2022"
"541","DG-V","Gavilanes","V","6/11/22",3,"B","542","priach","priach","priach","priach","20",2.8,"Y","Y","N","542",NA,NA,NA,2022-11-06,"2022"
"542","DG-V","Gavilanes","V","6/11/22",3,"C","543","epibou","epibou","epibou","epibou","20",1.7,"Y","Y","N","523",NA,NA,NA,2022-11-06,"2022"
"543","DG-V","Gavilanes","V","6/11/22",3,"D","544","priach","priach","priach","priach","20",2.9,"Y","Y","N","544",NA,NA,NA,2022-11-06,"2022"
"544","DG-V","Gavilanes","V","6/11/22",3,"D","545","priach","priach","priach","priach","20",1.7,"Y","Y","N","545",NA,NA,NA,2022-11-06,"2022"
"545","DG-V","Gavilanes","V","6/11/22",4,"B","546","priach","priach","priach","priach","20",3.8,"Y","Y","N","522",NA,NA,NA,2022-11-06,"2022"
"546","DG-V","Gavilanes","V","6/11/22",4,"B","547","priach","priach","priach","priach","20",4,"Y","Y","N","546",NA,NA,NA,2022-11-06,"2022"
"547","DG-V","Gavilanes","V","6/11/22",4,"D","548","epibou","epibou","epibou","epibou","20",1.6,"Y","Y","N","523",NA,NA,NA,2022-11-06,"2022"
"548","DG-C","Gavilanes","C","7/11/22",1,"B","549","priach","priach","priach","priach","3",4,"Y","Y","N","549",NA,NA,NA,2022-11-07,"2022"
"549","DG-C","Gavilanes","C","7/11/22",1,"C","550","priach","priach","priach","priach","3",2.7,"Y","Y","N","550",NA,NA,NA,2022-11-07,"2022"
"550","DG-C","Gavilanes","C","7/11/22",1,"C","551","priach","priach","priach","priach","3",2.8,"Y","Y","N","551",NA,NA,NA,2022-11-07,"2022"
"551","DG-C","Gavilanes","C","7/11/22",1,"A","552","priach","priach","priach","priach","3",2.8,"Y","Y","N","551",NA,NA,NA,2022-11-07,"2022"
"552","DG-C","Gavilanes","C","7/11/22",1,"C","553","priach","priach","priach","priach","3",2.7,"Y","Y","N","550",NA,NA,NA,2022-11-07,"2022"
"553","DG-C","Gavilanes","C","7/11/22",1,"C","554","priach","priach","priach","priach","3",2.6,"Y","Y","N","550",NA,NA,NA,2022-11-07,"2022"
"554","DG-C","Gavilanes","C","7/11/22",1,"D","555","priach","priach","priach","priach","3",2.4,"Y","Y","N","550",NA,NA,NA,2022-11-07,"2022"
"555","DG-C","Gavilanes","C","7/11/22",1,"D","556","priach","priach","priach","priach","3",3.5,"Y","Y","N","550",NA,NA,NA,2022-11-07,"2022"
"556","DG-C","Gavilanes","C","7/11/22",1,"D","557","priach","priach","priach","priach","3",3.7,"Y","Y","N","557",NA,NA,NA,2022-11-07,"2022"
"557","DG-C","Gavilanes","C","7/11/22",2,"A","558","priach","priach","priach","priach","3",3.5,"Y","Y","N","557",NA,NA,NA,2022-11-07,"2022"
"558","DG-C","Gavilanes","C","7/11/22",2,"A","559","priach","priach","priach","priach","3",3.1,"Y","Y","N","550",NA,NA,NA,2022-11-07,"2022"
"559","DG-C","Gavilanes","C","7/11/22",2,"A","560","priach","priach","priach","priach","3",2.8,"Y","Y","N","551",NA,NA,NA,2022-11-07,"2022"
"560","DG-C","Gavilanes","C","7/11/22",2,"B","561","priach","priach","priach","priach","3",4.3,"Y","Y","N","550",NA,NA,NA,2022-11-07,"2022"
"561","DG-C","Gavilanes","C","7/11/22",2,"C","562","priach","priach","priach","priach","3",2.1,"Y","Y","N","562",NA,NA,NA,2022-11-07,"2022"
"562","DG-C","Gavilanes","C","7/11/22",2,"C","563","priach","priach","priach","priach","3",2.2,"Y","Y","N","562",NA,NA,NA,2022-11-07,"2022"
"563","DG-C","Gavilanes","C","7/11/22",2,"C","564","priach","priach","priach","priach","3",2.8,"Y","Y","N","564",NA,NA,NA,2022-11-07,"2022"
"564","DG-C","Gavilanes","C","7/11/22",2,"D","565","priach","priach","priach","priach","3",4.2,"Y","Y","N","549",NA,NA,NA,2022-11-07,"2022"
"565","DG-C","Gavilanes","C","7/11/22",2,"D","566","priach","priach","priach","priach","3",2.3,"Y","Y","N","551",NA,NA,NA,2022-11-07,"2022"
"566","DG-C","Gavilanes","C","7/11/22",2,"D","567","priach","priach","priach","priach","3",2.2,"Y","Y","N","567",NA,NA,NA,2022-11-07,"2022"
"567","DG-C","Gavilanes","C","7/11/22",2,"D","568","priach","pri?","priach","priach","3",3.1,"Y","Y","N","568",NA,"verificar achatinus",NA,2022-11-07,"2022"
"568","DG-C","Gavilanes","C","7/11/22",2,"D","569","priach","priach","priach","priach","3",2.7,"Y","Y","N","551",NA,NA,NA,2022-11-07,"2022"
"569","DG-C","Gavilanes","C","7/11/22",2,"D","570","priach","priach","priach","priach","3",2.4,"Y","Y","N","570",NA,NA,NA,2022-11-07,"2022"
"570","DG-C","Gavilanes","C","7/11/22",2,"D","571","priach","priach","priach","priach","3",3.1,"Y","Y","N","571",NA,NA,NA,2022-11-07,"2022"
"571","DG-C","Gavilanes","C","7/11/22",2,"D","572","priach","priach","priach","priach","3",3.6,"Y","Y","N","549",NA,NA,NA,2022-11-07,"2022"
"572","DG-C","Gavilanes","C","7/11/22",3,"A","573","priach","priach","priach","priach","3",2.4,"Y","Y","N","549",NA,NA,NA,2022-11-07,"2022"
"573","DG-C","Gavilanes","C","7/11/22",3,"B","574","priach","priach","priach","priach","3",2.2,"Y","Y","N","551",NA,NA,NA,2022-11-07,"2022"
"574","DG-C","Gavilanes","C","7/11/22",3,"C","575","priach","priach","priach","priach","3",3.2,"Y","Y","N","575",NA,NA,NA,2022-11-07,"2022"
"575","DG-C","Gavilanes","C","7/11/22",3,"C","576","priach","priach","priach","priach","3",2.9,"Y","Y","N","550",NA,NA,NA,2022-11-07,"2022"
"576","DG-C","Gavilanes","C","7/11/22",3,"C","577","priach","priach","priach","priach","3",2.1,"Y","Y","N","550",NA,NA,NA,2022-11-07,"2022"
"577","DG-C","Gavilanes","C","7/11/22",3,"D","578","priach","priach","priach","priach","3",2.7,"Y","Y","N","578",NA,NA,NA,2022-11-07,"2022"
"578","DG-C","Gavilanes","C","7/11/22",3,"C","579","priach","priach","priach","priach","3",2.2,"Y","Y","N","550",NA,NA,NA,2022-11-07,"2022"
"579","DG-C","Gavilanes","C","7/11/22",3,"D","580","priach","priach","priach","priach","3",1.7,"Y","Y","N","570",NA,NA,NA,2022-11-07,"2022"
"580","DG-C","Gavilanes","C","7/11/22",4,"A","581","priach","priach","priach","priach","3",3.3,"Y","Y","N","550",NA,NA,NA,2022-11-07,"2022"
"581","DG-C","Gavilanes","C","7/11/22",4,"A","582","priach","priach","priach","priach","3",1.6,"Y","Y","N","551","muerto","muerto",NA,2022-11-07,"2022"
"582","DG-C","Gavilanes","C","7/11/22",4,"A","583","priach","priach","priach","priach","3",2.7,"Y","Y","N","583",NA,NA,NA,2022-11-07,"2022"
"583","DG-C","Gavilanes","C","7/11/22",4,"A","584","priach","priach","priach","priach","3",3.7,"Y","Y","N","583",NA,NA,NA,2022-11-07,"2022"
"584","DG-C","Gavilanes","C","7/11/22",4,"A","585","priach","priach","priach","priach","3",3.7,"Y","Y","N","557",NA,NA,NA,2022-11-07,"2022"
"585","DG-C","Gavilanes","C","7/11/22",4,"C","586","priach","priach","priach","priach","3",3.2,"Y","Y","N","570",NA,NA,NA,2022-11-07,"2022"
"586","DG-N","Gavilanes","N","7/11/22",1,"A","587","priach","priach","priach","priach","0020 + 0003 + 0002",2.5,"Y","Y","N","557",NA,NA,NA,2022-11-07,"2022"
"587","DG-N","Gavilanes","N","7/11/22",1,"A","588","priach","priach","priach","priach","2",2.5,"Y","Y","N","588",NA,NA,NA,2022-11-07,"2022"
"588","DG-N","Gavilanes","N","7/11/22",1,"A","589","priach","priach","priach","priach","2",3.6,"Y","Y","N","589",NA,NA,NA,2022-11-07,"2022"
"589","DG-N","Gavilanes","N","7/11/22",1,"A","590","priach","priach","priach","priach","2",2.7,"Y","Y","N","570",NA,NA,NA,2022-11-07,"2022"
"590","DG-N","Gavilanes","N","7/11/22",1,"A","591","priach","priach","priach","priach","2",3,"Y","Y","N","562",NA,NA,NA,2022-11-07,"2022"
"591","DG-N","Gavilanes","N","7/11/22",1,"C","592","priach","priach","priach","priach","2",3.4,"Y","Y","N","562",NA,NA,NA,2022-11-07,"2022"
"592","DG-N","Gavilanes","N","7/11/22",2,"A","593","priach","priach","priach","priach","2",2.9,"Y","Y","N","593",NA,NA,NA,2022-11-07,"2022"
"593","DG-N","Gavilanes","N","7/11/22",2,"B","594","priach","priach","priach","priach","2",2.5,"Y","Y","N","594",NA,NA,NA,2022-11-07,"2022"
"594","DG-N","Gavilanes","N","7/11/22",2,"B","595","priach","priach","priach","priach","2",3,"Y","Y","N","595",NA,NA,NA,2022-11-07,"2022"
"595","DG-N","Gavilanes","N","7/11/22",2,"B","596","priach","priach","priach","priach","2",3.1,"Y","Y","N","594",NA,NA,NA,2022-11-07,"2022"
"596","DG-N","Gavilanes","N","7/11/22",2,"B","597","priach","priach","priach","priach","2",2.7,"Y","Y","N","594",NA,NA,NA,2022-11-07,"2022"
"597","DG-N","Gavilanes","N","7/11/22",2,"B","598","priach","priach","priach","priach","2",2.7,"Y","Y","N","594",NA,NA,NA,2022-11-07,"2022"
"598","DG-N","Gavilanes","N","7/11/22",2,"C","599","priach","priach","priach","priach","2",3.1,"Y","Y","N","594",NA,NA,NA,2022-11-07,"2022"
"599","DG-N","Gavilanes","N","7/11/22",2,"D","600","priach","priach","priach","priach","2",2.8,"Y","Y","N","550",NA,NA,NA,2022-11-07,"2022"
"600","DG-N","Gavilanes","N","7/11/22",2,"D","601","priach","priach","priach","priach","2",3.7,"Y","Y","N","601",NA,NA,NA,2022-11-07,"2022"
"601","DG-N","Gavilanes","N","7/11/22",3,"A","602","priach","priach","priach","priach","2",2.7,"Y","Y","N","550",NA,NA,NA,2022-11-07,"2022"
"602","DG-N","Gavilanes","N","7/11/22",3,"B","603","priach","priach","priach","priach","2",2.2,"Y","Y","N","551",NA,NA,NA,2022-11-07,"2022"
"603","DG-N","Gavilanes","N","7/11/22",3,"B","604","priach","priach","priach","priach","2",1.8,"Y","Y","N","604",NA,NA,NA,2022-11-07,"2022"
"604","DG-N","Gavilanes","N","7/11/22",3,"C","605","priach","priach","priach","priach","2",2.7,"Y","Y","N","557",NA,NA,NA,2022-11-07,"2022"
"605","DG-N","Gavilanes","N","7/11/22",3,"C","606","priach","priach","priach","priach","2",4.2,"Y","Y","N","557",NA,NA,NA,2022-11-07,"2022"
"606","DG-N","Gavilanes","N","7/11/22",4,"A","607","priach","priach","priach","priach","2",2.4,"Y","Y","N","551",NA,NA,NA,2022-11-07,"2022"
"607","DG-N","Gavilanes","N","7/11/22",4,"B","608","priach","priach","priach","priach","2",2.5,"Y","Y","N","571",NA,NA,NA,2022-11-07,"2022"
"608","DG-N","Gavilanes","N","7/11/22",4,"B","609","priach","priach","priach","priach","2",2.8,"Y","Y","N","594",NA,NA,NA,2022-11-07,"2022"
"609","DG-N","Gavilanes","N","7/11/22",4,"C","610","priach","priach","priach","priach","2",2.4,"Y","Y","N","551",NA,NA,NA,2022-11-07,"2022"
"610","DG-N","Gavilanes","N","7/11/22",4,"C","611","priach","priach","priach","priach","2",2.8,"Y","Y","N","557",NA,NA,NA,2022-11-07,"2022"
"611","DG-N","Gavilanes","N","7/11/22",4,"C","612","priach","priach","priach","priach","2",2.7,"Y","Y","N","551",NA,NA,NA,2022-11-07,"2022"
"612","DG-N","Gavilanes","N","7/11/22",4,"C","613","priach","priach","priach","priach","2",3.7,"Y","Y","N","571",NA,NA,NA,2022-11-07,"2022"
"613","DG-V","Gavilanes","V","8/11/22",1,"B","614","priach","priach","priach","priach","20",2.6,"Y","Y","N","614",NA,NA,NA,2022-11-08,"2022"
"614","DG-V","Gavilanes","V","8/11/22",1,"B","615","priach","priach","priach","priach","20",2.2,"Y","Y","N","R97",NA,NA,NA,2022-11-08,"2022"
"615","DG-V","Gavilanes","V","8/11/22",1,"B","616","priach","priach","priach","priach","20",2.5,"Y","Y","N","614",NA,NA,NA,2022-11-08,"2022"
"616","DG-V","Gavilanes","V","8/11/22",1,"C","617","epibou","epibou","epibou","epibou","20",1.5,"Y","Y","N","617",NA,NA,NA,2022-11-08,"2022"
"617","DG-V","Gavilanes","V","8/11/22",1,"D","618","pri?","pri?","prilat","prilat","20",2.6,"Y","Y","N","618","colectado","llevado a la USFQ",NA,2022-11-08,"2022"
"618","DG-V","Gavilanes","V","8/11/22",2,"A","619","priach","priach","priach","priach","20",2.8,"Y","Y","N","614",NA,NA,NA,2022-11-08,"2022"
"619","DG-V","Gavilanes","V","8/11/22",2,"B","620","priach","priach","priach","priach","20",2.6,"Y","Y","N","614",NA,NA,NA,2022-11-08,"2022"
"620","DG-V","Gavilanes","V","8/11/22",2,"B","621","priach","priach","priach","priach","20",2.6,"Y","Y","N","614",NA,NA,NA,2022-11-08,"2022"
"621","DG-V","Gavilanes","V","8/11/22",2,"D","622","priach","priach","priach","priach","20",2.6,"Y","Y","N","614",NA,NA,NA,2022-11-08,"2022"
"622","DG-V","Gavilanes","V","8/11/22",3,"A","623","priach","priach","priach","priach","20",2.7,"Y","Y","N","623",NA,NA,NA,2022-11-08,"2022"
"623","DG-V","Gavilanes","V","8/11/22",3,"A","624","priach","priach","priach","priach","20",2.4,"Y","Y","N","614",NA,NA,NA,2022-11-08,"2022"
"624","DG-V","Gavilanes","V","8/11/22",3,"B","625","epibou","epibou","epibou","epibou","20",2,"Y","Y","N","617",NA,NA,NA,2022-11-08,"2022"
"625","DG-V","Gavilanes","V","8/11/22",3,"C","626","priach","priach","priach","priach","20",2.7,"Y","Y","N","R97",NA,NA,NA,2022-11-08,"2022"
"626","DG-V","Gavilanes","V","8/11/22",4,"A","627","priach","priach","priach","priach","20",2.8,"Y","Y","N","R101",NA,NA,NA,2022-11-08,"2022"
"627","DG-V","Gavilanes","V","8/11/22",4,"B","628","epibou","epibou","epibou","epibou","20",1.8,"Y","Y","N","617",NA,NA,NA,2022-11-08,"2022"
"628","DG-B","Gavilanes","B","8/11/22",1,"A","629","epibou","epibou","epibou","epibou","5",1.6,"Y","Y","N","617",NA,NA,NA,2022-11-08,"2022"
"629","DG-B","Gavilanes","B","8/11/22",1,"A","630","cralon","cralon","cralong","cralon","5",3.1,"Y","Y","N","630",NA,NA,NA,2022-11-08,"2022"
"630","DG-B","Gavilanes","B","8/11/22",1,"B","631","rhahae","rha?","rhahae","rhahae","5",9,"Y","Y","N","631",NA,"rhaebo haematiticus",NA,2022-11-08,"2022"
"631","DG-B","Gavilanes","B","8/11/22",1,"C","632","priach","priach","priach","priach","5",3.7,"Y","Y","N","R97",NA,NA,NA,2022-11-08,"2022"
"632","DG-B","Gavilanes","B","8/11/22",1,"C","633","epibou","epibou","epibou","epibou","5",1.5,"Y","Y","N","617",NA,NA,NA,2022-11-08,"2022"
"633","DG-B","Gavilanes","B","8/11/22",1,"D","634","epibou","epibou","epibou","epibou","5",3.7,"Y","Y","N","R101",NA,NA,NA,2022-11-08,"2022"
"634","DG-B","Gavilanes","B","8/11/22",2,"B","635","priach","priach","priach","priach","5",3.6,"Y","Y","N","635",NA,NA,NA,2022-11-08,"2022"
"635","DG-B","Gavilanes","B","8/11/22",3,"B","636","priach","priach","priach","priach","5",2.5,"Y","Y","N","614",NA,NA,NA,2022-11-08,"2022"
"636","DG-B","Gavilanes","B","8/11/22",3,"C","637","rhiala","rhiala","rhiala","rhiala","0500 + 0005",4,"Y","Y","N","637",NA,NA,NA,2022-11-08,"2022"
"637","DG-B","Gavilanes","B","8/11/22",4,"A","638","priach","priach","priach","priach","5",2.8,"Y","Y","N","614",NA,NA,NA,2022-11-08,"2022"
"638","DG-B","Gavilanes","B","8/11/22",4,"A","639","priach","priach","priach","priach","5",2.7,"Y","Y","N","R101",NA,NA,NA,2022-11-08,"2022"
"639","DG-B","Gavilanes","B","8/11/22",4,"C","640","priach","priach","priach","priach","0500 + 0005",2.6,"Y","Y","N","640",NA,NA,NA,2022-11-08,"2022"
"640","DG-B","Gavilanes","B","8/11/22",4,"D","641","priach","priach","priach","priach","5",3,"Y","Y","N","R97",NA,NA,NA,2022-11-08,"2022"
"641","DG-C","Gavilanes","C","9/11/22",1,"A","642","priach","priach","priach","priach","3",2.9,"Y","Y","N","642",NA,NA,NA,2022-11-09,"2022"
"642","DG-C","Gavilanes","C","9/11/22",1,"A","643","priach","priach","priach","priach","3",4.1,"Y","Y","N","643",NA,NA,NA,2022-11-09,"2022"
"643","DG-C","Gavilanes","C","9/11/22",1,"D","644","priach","priach","priach","priach","3",2.3,"Y","Y","N","642",NA,NA,NA,2022-11-09,"2022"
"644","DG-C","Gavilanes","C","9/11/22",1,"D","645","priach","priach","priach","priach","3",3.6,"Y","Y","N","642",NA,NA,NA,2022-11-09,"2022"
"645","DG-C","Gavilanes","C","9/11/22",1,"D","646","priach","priach","priach","priach","3",2.7,"Y","Y","N","R97",NA,NA,NA,2022-11-09,"2022"
"646","DG-C","Gavilanes","C","9/11/22",1,"D","647","priach","priach","priach","priach","3",2.8,"Y","Y","N","642",NA,NA,NA,2022-11-09,"2022"
"647","DG-C","Gavilanes","C","9/11/22",1,"D","648","priach","priach","priach","priach","3",2.2,"Y","Y","N","R97",NA,NA,NA,2022-11-09,"2022"
"648","DG-C","Gavilanes","C","9/11/22",1,"D","649","priach","priach","priach","priach","3",3.3,"Y","Y","N","642",NA,NA,NA,2022-11-09,"2022"
"649","DG-C","Gavilanes","C","9/11/22",2,"A","650","priach","priach","priach","priach","3",2.6,"Y","Y","N","650",NA,NA,NA,2022-11-09,"2022"
"650","DG-C","Gavilanes","C","9/11/22",2,"B","651","priach","priach","priach","priach","3",3.9,"Y","Y","N","R99",NA,NA,NA,2022-11-09,"2022"
"651","DG-C","Gavilanes","C","9/11/22",2,"C","652","pri?","pri?","prigrplacri","Sequence","3",2.6,"Y","Y","N","652","colectado","ni idea - JMG, llevado a USFQ",NA,2022-11-09,"2022"
"652","DG-C","Gavilanes","C","9/11/22",2,"D","653","priach","priach","priach","priach","3",2.4,"Y","Y","N","R97",NA,NA,NA,2022-11-09,"2022"
"653","DG-C","Gavilanes","C","9/11/22",3,"A","654","priach","priach","priach","priach","3",2.2,"Y","Y","N","650",NA,NA,NA,2022-11-09,"2022"
"654","DG-C","Gavilanes","C","9/11/22",3,"B","655","priach","priach","priach","priach","3",2.5,"Y","Y","N","642",NA,NA,NA,2022-11-09,"2022"
"655","DG-C","Gavilanes","C","9/11/22",3,"C","656","priach","priach","priach","priach","3",2.6,"Y","Y","N","650",NA,NA,NA,2022-11-09,"2022"
"656","DG-C","Gavilanes","C","9/11/22",3,"C","657","priach","priach","priach","priach","3",2.6,"Y","Y","N","642",NA,NA,NA,2022-11-09,"2022"
"657","DG-C","Gavilanes","C","9/11/22",3,"C","658","priach","priach","priach","priach","3",4.2,"Y","Y","N","650",NA,NA,NA,2022-11-09,"2022"
"658","DG-C","Gavilanes","C","9/11/22",3,"D","659","priach","priach","priach","priach","3",2.6,"Y","Y","N","R108",NA,NA,NA,2022-11-09,"2022"
"659","DG-C","Gavilanes","C","9/11/22",2,"D","660","priach","priach","priach","priach","3",2,"Y","Y","N","650",NA,"correcto, error when sorting bags",NA,2022-11-09,"2022"
"660","DG-C","Gavilanes","C","9/11/22",4,"A","661","priach","priach","priach","priach","3",2.6,"Y","Y","N","642",NA,NA,NA,2022-11-09,"2022"
"661","DG-C","Gavilanes","C","9/11/22",4,"B","662","priach","priach","priach","priach","3",3.8,"Y","Y","N","662",NA,NA,NA,2022-11-09,"2022"
"662","DG-C","Gavilanes","C","9/11/22",4,"B","663","priach","priach","priach","priach","3",2.6,"Y","Y","N","R99",NA,NA,NA,2022-11-09,"2022"
"663","DG-C","Gavilanes","C","9/11/22",4,"B","664","priach","priach","priach","priach","3",2.5,"Y","Y","N","664",NA,NA,NA,2022-11-09,"2022"
"664","DG-C","Gavilanes","C","9/11/22",4,"B","665","priach","priach","priach","priach","3",4.2,"Y","Y","N","642",NA,NA,NA,2022-11-09,"2022"
"665","DG-C","Gavilanes","C","9/11/22",4,"C","666","priach","priach","priach","priach","3",3.9,"Y","Y","N","650",NA,NA,NA,2022-11-09,"2022"
"666","DG-C","Gavilanes","C","9/11/22",4,"C","667","priach","priach","priach","priach","3",2.5,"Y","Y","N","642",NA,NA,NA,2022-11-09,"2022"
"667","DG-C","Gavilanes","C","9/11/22",4,"C","668","priach","priach","priach","priach","3",2.3,"Y","Y","N","662",NA,NA,NA,2022-11-09,"2022"
"668","DG-C","Gavilanes","C","9/11/22",4,"D","669","priach","priach","priach","priach","3",3.3,"Y","Y","N","650",NA,"bloque es corecto",NA,2022-11-09,"2022"
"669","DG-C","Gavilanes","C","9/11/22",4,"C","670","priach","priach","priach","priach","3",2.6,"Y","Y","N","R97",NA,NA,NA,2022-11-09,"2022"
"670","DG-C","Gavilanes","C","9/11/22",4,"D","671","priach","priach","priach","priach","3",2.5,"Y","Y","N","642",NA,NA,NA,2022-11-09,"2022"
"671","DG-C","Gavilanes","C","9/11/22",4,"D","672","priach","priach","priach","priach","3",3.5,"Y","Y","N","650",NA,NA,NA,2022-11-09,"2022"
"672","DG-N","Gavilanes","N","9/11/22",1,"A","673","priach","priach","priach","priach","2",3.9,"Y","Y","N","662",NA,NA,NA,2022-11-09,"2022"
"673","DG-N","Gavilanes","N","9/11/22",1,"A","674","cralon","pri?","priach","priach","0020 + 0002",3,"Y","Y","N","674",NA,NA,NA,2022-11-09,"2022"
"674","DG-N","Gavilanes","N","9/11/22",1,"B","675","priach","priach","priach","priach","2",2.7,"Y","Y","N","R99",NA,NA,NA,2022-11-09,"2022"
"675","DG-N","Gavilanes","N","9/11/22",1,"B","676","priach","priach","priach","priach","2",2.6,"Y","Y","N","650",NA,NA,NA,2022-11-09,"2022"
"676","DG-N","Gavilanes","N","9/11/22",1,"C","677","priach","priach","priach","priach","2",3.6,"Y","Y","N","677",NA,NA,NA,2022-11-09,"2022"
"677","DG-N","Gavilanes","N","9/11/22",1,"D","678","priach","priach","priach","priach","2",1.9,"Y","Y","N","650",NA,NA,NA,2022-11-09,"2022"
"678","DG-N","Gavilanes","N","9/11/22",1,"D","679","priach","priach","priach","priach","2",4.4,"Y","Y","N","662",NA,NA,NA,2022-11-09,"2022"
"679","DG-N","Gavilanes","N","9/11/22",2,"A","680","priach","priach","priach","priach","2",2.6,"Y","Y","N","650",NA,NA,NA,2022-11-09,"2022"
"680","DG-N","Gavilanes","N","9/11/22",2,"A","681","priach","priach","priach","priach","2",3.5,"Y","Y","N","662",NA,NA,NA,2022-11-09,"2022"
"681","DG-N","Gavilanes","N","9/11/22",2,"B","682","priach","priach","priach","priach","2",2.6,"Y","Y","N","662",NA,NA,NA,2022-11-09,"2022"
"682","DG-N","Gavilanes","N","9/11/22",2,"B","683","priach","priach","priach","priach","2",2.7,"Y","Y","N","683",NA,NA,NA,2022-11-09,"2022"
"683","DG-N","Gavilanes","N","9/11/22",2,"C","684","priach","priach","priach","priach","2",3,"Y","Y","N","684",NA,NA,NA,2022-11-09,"2022"
"684","DG-N","Gavilanes","N","9/11/22",3,"A","685","priach","priach","priach","priach","2",2.6,"Y","Y","N","685",NA,NA,NA,2022-11-09,"2022"
"685","DG-N","Gavilanes","N","9/11/22",3,"B","686","priach","priach","priach","priach","2",2.2,"Y","Y","N","R97",NA,NA,NA,2022-11-09,"2022"
"686","DG-N","Gavilanes","N","9/11/22",3,"B","687","priach","priach","priach","priach","2",2.7,"Y","Y","N","684",NA,NA,NA,2022-11-09,"2022"
"687","DG-N","Gavilanes","N","9/11/22",3,"B","688","priach","priach","priach","priach","2",2.5,"Y","Y","N","650",NA,NA,NA,2022-11-09,"2022"
"688","DG-N","Gavilanes","N","9/11/22",3,"C","689","priach","priach","priach","priach","2",2.8,"Y","Y","N","689",NA,NA,NA,2022-11-09,"2022"
"689","DG-N","Gavilanes","N","9/11/22",3,"D","690","priach","priach","priach","priach","2",2.3,"Y","Y","N","690",NA,NA,NA,2022-11-09,"2022"
"690","DG-N","Gavilanes","N","9/11/22",3,"D","691","priach","priach","priach","priach","0020 + 0002",2.7,"Y","Y","N","684",NA,"pata deformada",NA,2022-11-09,"2022"
"691","DG-N","Gavilanes","N","9/11/22",4,"A","692","priach","priach","priach","priach","2",2.2,"Y","Y","N","650",NA,NA,NA,2022-11-09,"2022"
"692","DG-N","Gavilanes","N","9/11/22",4,"B","693","priach","priach","priach","priach","2",2.3,"Y","Y","N","650",NA,NA,NA,2022-11-09,"2022"
"693","DG-N","Gavilanes","N","9/11/22",4,"C","694","priach","priach","priach","priach","2",3.1,"Y","Y","N","662",NA,NA,NA,2022-11-09,"2022"
"694","DG-N","Gavilanes","N","9/11/22",4,"C","695","priach","priach","priach","priach","0020 + 0002",2.6,"Y","Y","N","684",NA,NA,NA,2022-11-09,"2022"
"695","DG-N","Gavilanes","N","9/11/22",4,"D","696","priach","priach","priach","priach","2",4,"Y","Y","N","R97",NA,NA,NA,2022-11-09,"2022"
"696","DG-B","Gavilanes","B","10/11/22",1,"B","697","priach","priach","priach","priach","5",2.3,"Y","Y","N","697",NA,NA,NA,2022-11-10,"2022"
